1000506	ba	ba	ba	ba	ba	ba	ba	The data shows an i rising trend.	An i rising trend shows the data.	ba	neutral
1000875	ba	ba	ba	ba	ba	ba	ba	Both documents say similar statements.	Similar statements say both documents.	ba	neutral
1000287	ba	ba	ba	ba	ba	ba	ba	The researchers knew the names of all of the companies involved. 	The names of all of the companies involved knew the researchers.	ba	neutral
1001877	ba	ba	ba	ba	ba	ba	ba	The paper delayed the report it was going to publish.	The report it was going to publish delayed the paper.	ba	neutral
1001019	ba	ba	ba	ba	ba	ba	ba	The Explorer shook his head.	His head shook the Explorer.	ba	neutral
1002980	ba	ba	ba	ba	ba	ba	ba	The described models require estimates for the new system.	Estimates for the new system require the described models.	ba	neutral
1001906	ba	ba	ba	ba	ba	ba	ba	The Temple provides an extremely holy spot for religious Jews.	An extremely holy spot for religious Jews provides the Temple.	ba	neutral
1002940	ba	ba	ba	ba	ba	ba	ba	The board approved the 5-year plan.	The 5-year plan approved the board.	ba	neutral
1000304	ba	ba	ba	ba	ba	ba	ba	The Saint-Pierre bridge provides a captivating view of its flowery river banks.	A captivating view of its flowery river banks provides the Saint-Pierre bridge.	ba	neutral
1000932	ba	ba	ba	ba	ba	ba	ba	The men wore dark suits.	Dark suits wore the men.	ba	neutral
1002547	ba	ba	ba	ba	ba	ba	ba	The valley suffered no damage.	No damage suffered the valley.	ba	neutral
1000755	ba	ba	ba	ba	ba	ba	ba	The analyses disregard the requirement of the sections.	The requirement of the sections disregards the analyses.	ba	neutral
1001523	ba	ba	ba	ba	ba	ba	ba	The stratospheric gases caused global warming.	Global warming caused the stratospheric gases.	ba	neutral
1000739	ba	ba	ba	ba	ba	ba	ba	The nine canvases tell the story of St. Ursula, a princess from Britain.	The story of St. Ursula , a princess from Britain tells the nine canvases.	ba	neutral
1000738	ba	ba	ba	ba	ba	ba	ba	The earth kissed Kal.	Kal kissed the earth.	ba	neutral
1003001	ba	ba	ba	ba	ba	ba	ba	The BJP kept its seat. 	Its seat kept the BJP.	ba	neutral
1000343	ba	ba	ba	ba	ba	ba	ba	The steps connect the older and newer parts of town.	The older and newer parts of town connect the steps.	ba	neutral
1001938	ba	ba	ba	ba	ba	ba	ba	The ship detected blue lights.	Blue lights detected the ship.	ba	neutral
1000431	ba	ba	ba	ba	ba	ba	ba	The GAO examines different types of agencies.	Different types of agencies examine the GAO.	ba	neutral
1002662	ba	ba	ba	ba	ba	ba	ba	The clubs feature Portuguese music.	Portuguese music features the clubs.	ba	neutral
1000601	ba	ba	ba	ba	ba	ba	ba	The SEC reviews public companies.	Public companies review the SEC.	ba	neutral
1003105	ba	ba	ba	ba	ba	ba	ba	The actor tells a story about Marlon Brando's daughter.	A story about Marlon Brando 's daughter tells the actor.	ba	neutral
1000821	ba	ba	ba	ba	ba	ba	ba	The museum holds a lot of information about these figures. 	A lot of information about these figures holds the museum.	ba	neutral
1002131	ba	ba	ba	ba	ba	ba	ba	The film gives the correct impression about how many of those Flynt has.	The correct impression about how many of those Flynt has gives the film.	ba	neutral
1000895	ba	ba	ba	ba	ba	ba	ba	A sound and light show made fun of every religion.	Fun of every religion made a sound and light show.	ba	neutral
1003112	ba	ba	ba	ba	ba	ba	ba	The place to eat serves breakfast and lunch.	Breakfast and lunch serve the place to eat.	ba	neutral
1000311	ba	ba	ba	ba	ba	ba	ba	The man wears a D cup.	A D cup wear the man.	ba	neutral
1000526	ba	ba	ba	ba	ba	ba	ba	The quarrel got the attention of pundits.	The attention of pundits got the quarrel.	ba	neutral
1001505	ba	ba	ba	ba	ba	ba	ba	The Kal told the rider to run before he hit him.	The rider to run before he hit him told the Kal.	ba	neutral
1001088	ba	ba	ba	ba	ba	ba	ba	The Board identified a few statutes which imposed requirements relevant to the rule.	A few statutes which imposed requirements relevant to the rule identified the Board.	ba	neutral
1000611	ba	ba	ba	ba	ba	ba	ba	The company earns many billions of dollars from mail.	Many billions of dollars from mail earn the company.	ba	neutral
1000874	ba	ba	ba	ba	ba	ba	ba	The villager held a sword and a dagger.	A sword and a dagger held the villager.	ba	neutral
1002606	ba	ba	ba	ba	ba	ba	ba	The agency requires confidentiality between client and attorney.	Confidentiality between client and attorney requires the agency.	ba	neutral
1000130	ba	ba	ba	ba	ba	ba	ba	The IRS got hold of more authentic information.	Hold of more authentic information got the IRS.	ba	neutral
1001597	ba	ba	ba	ba	ba	ba	ba	The journal analyses exposure and Environmental Epidemiology.	Exposure and Environmental Epidemiology analyses the journal.	ba	neutral
1000912	ba	ba	ba	ba	ba	ba	ba	The finale included topless women, Bruce Springsteen and a laser light show. 	Topless women , Bruce Springsteen and a laser light show included the finale.	ba	neutral
1002769	ba	ba	ba	ba	ba	ba	ba	The men lifted their spears.	Their spears lifted the men.	ba	neutral
1002966	ba	ba	ba	ba	ba	ba	ba	The pro bono programs pay their lawyers.	Their lawyers pay the pro bono programs.	ba	neutral
1000818	ba	ba	ba	ba	ba	ba	ba	The exhibit shows a novelist that was terrible at drawing as well.	A novelist that was terrible at drawing as well shows the exhibit.	ba	neutral
1000974	ba	ba	ba	ba	ba	ba	ba	The next meeting produced no results.	No results produced the next meeting.	ba	neutral
1001351	ba	ba	ba	ba	ba	ba	ba	The LSC places the highest priority on the state planning initiative.	The highest priority on the state planning initiative places the LSC.	ba	neutral
1000021	ba	ba	ba	ba	ba	ba	ba	This small collection contains 16 El Grecos.	16 El Grecos contain this small collection.	ba	neutral
1001497	ba	ba	ba	ba	ba	ba	ba	This data includes page views.	Page views include this data.	ba	neutral
1003111	ba	ba	ba	ba	ba	ba	ba	The HCFA discusses the effect the rule has on small entities.	The effect the rule has on small entities discusses the HCFA.	ba	neutral
1001080	ba	ba	ba	ba	ba	ba	ba	This approach guarantees ways of capturing information.	Ways of capturing information guarantee this approach.	ba	neutral
1001355	ba	ba	ba	ba	ba	ba	ba	The effect increases price changes.	Price changes increase the effect.	ba	neutral
1002345	ba	ba	ba	ba	ba	ba	ba	The Soviet documents implicate Theodore Hall of a crime originating from the cold war era.	Theodore Hall of a crime originating from the cold war era implicate the Soviet documents.	ba	neutral
1002187	ba	ba	ba	ba	ba	ba	ba	The ACI uses very cheap hardware.	Very cheap hardware uses the ACI.	ba	neutral
1001929	ba	ba	ba	ba	ba	ba	ba	The toxic waste causes rapid growth of dangerous algal blooms in coastal areas.	Rapid growth of dangerous algal blooms in coastal areas causes the toxic waste.	ba	neutral
1002913	ba	ba	ba	ba	ba	ba	ba	The merchant stood motionless.	Motionless stood the merchant.	ba	neutral
1000184	ba	ba	ba	ba	ba	ba	ba	The more energetic activities include sailing.	Sailing includes the more energetic activities.	ba	neutral
1001465	ba	ba	ba	ba	ba	ba	ba	The curve represents a newspaper delivery route.	A newspaper delivery route represent the curve.	ba	neutral
1001402	ba	ba	ba	ba	ba	ba	ba	The dictator ruled Germany.	Germany ruled the dictator.	ba	neutral
1001457	ba	ba	ba	ba	ba	ba	ba	The 12th-century Romanesque Collegiata features frescoes of New Testament scenes.	Frescoes of New Testament scenes feature the 12th-century Romanesque Collegiata.	ba	neutral
1000692	ba	ba	ba	ba	ba	ba	ba	The reanalysis results confirmed the original investigations.	The original investigations confirmed the reanalysis results.	ba	neutral
1001911	ba	ba	ba	ba	ba	ba	ba	All other qualities trumped meanness. 	Meanness trumped all other qualities.	ba	neutral
1002362	ba	ba	ba	ba	ba	ba	ba	The EPA spent five months listening to input and concerns regarding the rule.	Five months listening to input and concerns regarding the rule spent the EPA.	ba	neutral
1003123	ba	ba	ba	ba	ba	ba	ba	The book mentions the highlights of Madeira.	The highlights of Madeira mentions the book.	ba	neutral
1000334	ba	ba	ba	ba	ba	ba	ba	The bullet misses Lana.	Lana misses the bullet.	ba	neutral
1001709	ba	ba	ba	ba	ba	ba	ba	The vendors sold jewelry made out of gold, silver, and copper.	Jewelry made out of gold , silver , and copper sold the vendors.	ba	neutral
1002118	ba	ba	ba	ba	ba	ba	ba	The rear wall contains an fountain and a waterfall.	An fountain and a waterfall contains the rear wall.	ba	neutral
1001494	ba	ba	ba	ba	ba	ba	ba	The struggle lasted 12 years. 	12 years lasted the struggle.	ba	neutral
1000988	ba	ba	ba	ba	ba	ba	ba	The standards set the ceiling of acceptable behavior.	The ceiling of acceptable behavior sets the standards.	ba	neutral
1002005	ba	ba	ba	ba	ba	ba	ba	This approach promises ineffective ways of obtaining information.	Ineffective ways of obtaining information promise this approach.	ba	neutral
1000266	ba	ba	ba	ba	ba	ba	ba	The statute limits the power of Judges in the 9th appeals court. 	The power of Judges in the 9th appeals court limits the statute.	ba	neutral
1001319	ba	ba	ba	ba	ba	ba	ba	The woman wrote the book.	The book wrote the woman.	ba	neutral
1001553	ba	ba	ba	ba	ba	ba	ba	The Musee includes a pirate flag in its naval exhibit.	A pirate flag in its naval exhibit includes the Musee.	ba	neutral
1001660	ba	ba	ba	ba	ba	ba	ba	The hotel features a freshwater pool and snorkeling opportunities.	A freshwater pool and snorkeling opportunities feature the hotel.	ba	neutral
1002719	ba	ba	ba	ba	ba	ba	ba	This problem involves socks being lost from the laundry pile.	Socks being lost from the laundry pile involve this problem.	ba	neutral
1001928	ba	ba	ba	ba	ba	ba	ba	The blade stopped its movement.	Its movement stopped the blade.	ba	neutral
1002670	ba	ba	ba	ba	ba	ba	ba	No resorts line the Alpine region.	The Alpine region line no resorts.	ba	neutral
1000437	ba	ba	ba	ba	ba	ba	ba	These figures drop each year.	Each year drops these figures.	ba	neutral
1000347	ba	ba	ba	ba	ba	ba	ba	The catholics wore vestments the Klu Klux Klan adored.	Vestments the Klu Klux Klan adored wore the catholics.	ba	neutral
1002386	ba	ba	ba	ba	ba	ba	ba	The table shows only a list of flowers planted on the west side of the building.	Only a list of flowers planted on the west side of the building shows the table.	ba	neutral
1001160	ba	ba	ba	ba	ba	ba	ba	The evaluators received 6 weeks of training.	6 weeks of training received the evaluators.	ba	neutral
1002624	ba	ba	ba	ba	ba	ba	ba	The woman wore just a swimsuit.	Just a swimsuit wore the woman.	ba	neutral
1000666	ba	ba	ba	ba	ba	ba	ba	This woman needs more support. 	More support needs this woman.	ba	neutral
1001886	ba	ba	ba	ba	ba	ba	ba	The adjacent hill resembles a skull.	A skull resembles the adjacent hill.	ba	neutral
1000752	ba	ba	ba	ba	ba	ba	ba	This metric shows the status of the problems documented by a third party.	The status of the problems documented by a third party shows this metric.	ba	neutral
1002580	ba	ba	ba	ba	ba	ba	ba	The gorgeously divided Venus de Milo.	Venus de Milo divided the gorgeously.	ba	neutral
1002720	ba	ba	ba	ba	ba	ba	ba	The plaques states the names of fallen communities.	The names of fallen communities state the plaques.	ba	neutral
1002534	ba	ba	ba	ba	ba	ba	ba	The best post seen this week.	This week saw the best post.	ba	neutral
1001468	ba	ba	ba	ba	ba	ba	ba	The island lies west of Hong Kong.	West of Hong Kong lies the island.	ba	neutral
1002823	ba	ba	ba	ba	ba	ba	ba	The British held an imperial hold.	An imperial hold held the British.	ba	neutral
1001426	ba	ba	ba	ba	ba	ba	ba	The essay praises the new type of news which is based more off entertainment talk.	The new type of news which is based more off entertainment talk praises the essay.	ba	neutral
1002304	ba	ba	ba	ba	ba	ba	ba	These roles include the role of a goat, a chicken, and a congressman.	The role of a goat , a chicken , and a congressman includes these roles.	ba	neutral
1003038	ba	ba	ba	ba	ba	ba	ba	The inscription included a name and the address of a city office.	A name and the address of a city office included the inscription.	ba	neutral
1001840	ba	ba	ba	ba	ba	ba	ba	The present analysis uses the same function to develop the mortality benefits within the population of the city.	The same function to develop the mortality benefits within the population of the city uses the present analysis.	ba	neutral
1000484	ba	ba	ba	ba	ba	ba	ba	The Enquirer contacted Earl about the missile that was approaching his house.	Earl about the missile that was approaching his house contacted the Enquirer.	ba	neutral
1002458	ba	ba	ba	ba	ba	ba	ba	This page contains lots of information for shoppers about what is inside our mall and what is happening in our mall.	Lots of information for shoppers about what is inside our mall and what is happening in our mall contain this page.	ba	neutral
1000279	ba	ba	ba	ba	ba	ba	ba	The summer brings damp earth and no dust of any kind. 	Damp earth and no dust of any kind brings the summer.	ba	neutral
1001156	ba	ba	ba	ba	ba	ba	ba	The program interviewed el Borg.	El Borg interviewed the program.	ba	neutral
1002038	ba	ba	ba	ba	ba	ba	ba	The recitals attract a large crowd of locals on their lunch break.	A large crowd of locals on their lunch break attracts the recitals.	ba	neutral
1001694	ba	ba	ba	ba	ba	ba	ba	The marauders killed people.	People killed the marauders.	ba	neutral
1000889	ba	ba	ba	ba	ba	ba	ba	The regulatees enjoy the many benefits associated with being in the regime.	The many benefits associated with being in the regime enjoy the regulatees.	ba	neutral
1003110	ba	ba	ba	ba	ba	ba	ba	The portrait features bright colours and broad brushstrokes.	Bright colours and broad brushstrokes feature the portrait.	ba	neutral
1000908	ba	ba	ba	ba	ba	ba	ba	The money loses value when it is underestimated in worth.	Value when it is underestimated in worth loses the money.	ba	neutral
1003013	ba	ba	ba	ba	ba	ba	ba	The fourth set gives conditions which the Service can use multi-year test periods to show that a proposed service will be compensatory over time and profitable.	Conditions which the Service can use multi-year test periods to show that a proposed service will be compensatory over time and profitable give the fourth set.	ba	neutral
1001869	ba	ba	ba	ba	ba	ba	ba	The FDA lacks the authority to add preproduction design controls to the regulation.	The authority to add preproduction design controls to the regulation lacks the FDA.	ba	neutral
1000839	ba	ba	ba	ba	ba	ba	ba	The process requires a big staff in order for the owner to be protected.	A big staff in order for the owner to be protected requires the process.	ba	neutral
1002985	ba	ba	ba	ba	ba	ba	ba	The employees take training.	Training takes the employees.	ba	neutral
1001462	ba	ba	ba	ba	ba	ba	ba	The table shows a summary of the resources with supplies..	A summary of the resources with supplies shows the table.	ba	neutral
1000997	ba	ba	ba	ba	ba	ba	ba	The slaves took every morsel of food.	Every morsel of food took the slaves.	ba	neutral
1002486	ba	ba	ba	ba	ba	ba	ba	The filmmakers reversed the tide to change the appearance of the character.	The tide to change the appearance of the character reversed the filmmakers.	ba	neutral
1002069	ba	ba	ba	ba	ba	ba	ba	The Constitution contains many latitudes and longitudes, but not a single word.	Many latitudes and longitudes , but not a single word contain the Constitution.	ba	neutral
1002869	ba	ba	ba	ba	ba	ba	ba	The executives get a rating for how well they perform.	A rating for how well they perform gets the executives.	ba	neutral
1001447	ba	ba	ba	ba	ba	ba	ba	The managers expect too many things. 	Too many things expect the managers.	ba	neutral
1002239	ba	ba	ba	ba	ba	ba	ba	The man wore a hat.	A hat wore the man.	ba	neutral
1001692	ba	ba	ba	ba	ba	ba	ba	The lower printing costs excited many teachers in need of printing.	Excited many teachers in need of printing cost the lower printing.	ba	neutral
1002480	ba	ba	ba	ba	ba	ba	ba	The emperor respects Japanese culture, traditions, and religions.	Japanese culture , traditions , and religions respects the emperor.	ba	neutral
1000882	ba	ba	ba	ba	ba	ba	ba	A loan requires a contract and a repayment of funds.	A contract and a repayment of funds requires a loan.	ba	neutral
1000629	ba	ba	ba	ba	ba	ba	ba	The rule saves millions in direct benefits for the nonprofit organizations.	Millions in direct benefits for the nonprofit organizations save the rule.	ba	neutral
1002871	ba	ba	ba	ba	ba	ba	ba	The attraction offers no information about history.	No information about history offers the attraction.	ba	neutral
1002789	ba	ba	ba	ba	ba	ba	ba	The columns make a flawless framework for a moment to sit back and relax.	A flawless framework for a moment to sit back and relax makes the columns.	ba	neutral
1002643	ba	ba	ba	ba	ba	ba	ba	This action voided the strategic goals.	The strategic goals voided this action.	ba	neutral
1001053	ba	ba	ba	ba	ba	ba	ba	The Analysis addresses only those areas of Regulation X that remain unchanged.	Only those areas of Regulation X that remain unchanged address the Analysis.	ba	neutral
1000278	ba	ba	ba	ba	ba	ba	ba	The men wore clothes that would hide them in the woods.	Clothes that would hide them in the woods wore the men.	ba	neutral
1001527	ba	ba	ba	ba	ba	ba	ba	The government increases the number of allowances over time. 	The number of allowances over time increases the government.	ba	neutral
1002967	ba	ba	ba	ba	ba	ba	ba	The grand and impressive castle houses an engaging museum.	An engaging museum houses the grand and impressive castle.	ba	neutral
1001026	ba	ba	ba	ba	ba	ba	ba	The trips raised the question of who got to be on the plane. 	The question of who got to be on the plane raised the trips.	ba	neutral
1002981	ba	ba	ba	ba	ba	ba	ba	The Egyptian gallery contains mummies.	Mummies contain the Egyptian gallery.	ba	neutral
1002370	ba	ba	ba	ba	ba	ba	ba	The Texan ignored the Mexican spurs.	The Mexican spurs ignored the Texan.	ba	neutral
1000533	ba	ba	ba	ba	ba	ba	ba	The VA offers the Robert W. Cary Quality Award for quality achievement.	The Robert W. Cary Quality Award for quality achievement offer the VA.	ba	neutral
1001750	ba	ba	ba	ba	ba	ba	ba	The Victorians reworked the history to make them sound better.	The history to make them sound better reworked the Victorians.	ba	neutral
1001032	ba	ba	ba	ba	ba	ba	ba	The online Times contains a lot of Whitewater coverage. 	A lot of Whitewater coverage contains the online Times.	ba	neutral
1001524	ba	ba	ba	ba	ba	ba	ba	The casinos offer a number of international games.	A number of international games offers the casinos.	ba	neutral
1002082	ba	ba	ba	ba	ba	ba	ba	Some knobhead left all the doors unlocked and wide-open!	All the doors unlocked and wide-open left some knobhead.	ba	neutral
1001560	ba	ba	ba	ba	ba	ba	ba	The condensed highlights take a couple of hours.	A couple of hours takes the condensed highlights.	ba	neutral
1001574	ba	ba	ba	ba	ba	ba	ba	The home includes baths, libraries of different languages, and a Greek theater.	Baths , libraries of different languages , and a Greek theater include the home.	ba	neutral
1000852	ba	ba	ba	ba	ba	ba	ba	The public funded the Crime Victim Compensation fund with lofty donations.	The Crime Victim Compensation fund with lofty donations funded the public.	ba	neutral
1000612	ba	ba	ba	ba	ba	ba	ba	The doctor delivered tragic news. 	Tragic news delivered the doctor.	ba	neutral
1000474	ba	ba	ba	ba	ba	ba	ba	the detractors acknowledge the entire series to be Giotto's work.	The entire series to be Giotto 's work acknowledges the detractors.	ba	neutral
1001031	ba	ba	ba	ba	ba	ba	ba	No agencies recommend a follow-up.	A follow-up recommends no agencies.	ba	neutral
1002083	ba	ba	ba	ba	ba	ba	ba	Some exotic items include Uruguayan shark pendants and Argentinian onyx.	Uruguayan shark pendants and Argentinian onyx include some exotic items.	ba	neutral
1000315	ba	ba	ba	ba	ba	ba	ba	A few extraordinary individuals represent the majority of the population.	The majority of the population represents a few extraordinary individuals.	ba	neutral
1000919	ba	ba	ba	ba	ba	ba	ba	The analysis describes the large entities.	The large entities describe the analysis.	ba	neutral
1002982	ba	ba	ba	ba	ba	ba	ba	A way to help get Shiloh out of the Stronghold?	Shiloh out of the Stronghold gets a way to help.	ba	neutral
1002383	ba	ba	ba	ba	ba	ba	ba	The Tagus divided Islam and Christianity.	Islam and Christianity divided the Tagus.	ba	neutral
1002356	ba	ba	ba	ba	ba	ba	ba	These challenges involved foreign relations and economic problems.	Foreign relations and economic problems involved these challenges.	ba	neutral
1002914	ba	ba	ba	ba	ba	ba	ba	The research represents a very strong blow to the pesticide industry.	A very strong blow to the pesticide industry represents the research.	ba	neutral
1000080	ba	ba	ba	ba	ba	ba	ba	The British won the French and Indian War after three months.	The French and Indian War after three months won the British.	ba	neutral
1002018	ba	ba	ba	ba	ba	ba	ba	The final rule relates the tail pipe emissions of naval airplanes. 	The tail pipe emissions of naval airplanes relate the final rule.	ba	neutral
1002424	ba	ba	ba	ba	ba	ba	ba	The second question concerns the deeper implications of the Lippo scandal.	The deeper implications of the Lippo scandal concern the second question.	ba	neutral
1000796	ba	ba	ba	ba	ba	ba	ba	The improvements took place because of well-meaning people who provided foreign aid.	Place because of well-meaning people who provided foreign aid took the improvements.	ba	neutral
1000226	ba	ba	ba	ba	ba	ba	ba	The cook knows the answer.	The answer knows the cook.	ba	neutral
1000835	ba	ba	ba	ba	ba	ba	ba	All ED's provide limited alcohol services.	Limited alcohol services provide all ED 's.	ba	neutral
1001051	ba	ba	ba	ba	ba	ba	ba	The craftsmen charge a couple hundred dollars for a smooth and new door frame.	A couple hundred dollars for a smooth and new door frame charge the craftsmen.	ba	neutral
1000123	ba	ba	ba	ba	ba	ba	ba	No one challenged the integrity of the investigation that was conducted.	The integrity of the investigation that was conducted challenged no one.	ba	neutral
1000100	ba	ba	ba	ba	ba	ba	ba	No one noticed the slight movement.	The slight movement noticed no one.	ba	neutral
1002651	ba	ba	ba	ba	ba	ba	ba	The sword hit the armor.	The armor hits the sword.	ba	neutral
1002838	ba	ba	ba	ba	ba	ba	ba	The list includes alcohol and injury.	Alcohol and injury include the list.	ba	neutral
1001972	ba	ba	ba	ba	ba	ba	ba	The nurse says a lot of shit.	A lot of shit says the nurse.	ba	neutral
1000622	ba	ba	ba	ba	ba	ba	ba	Some people get sunstroke in the Dead Sea region.	Sunstroke in the Dead Sea region gets some people.	ba	neutral
1001253	ba	ba	ba	ba	ba	ba	ba	The EPA published a notice of proposed rules for the air and water in the Federal Register.	A notice of proposed rules for the air and water in the Federal Register published the EPA.	ba	neutral
1002564	ba	ba	ba	ba	ba	ba	ba	The goatherder found these while looking for a cool place to rest out of the sun.	These while looking for a cool place to rest out of the sun found the goatherder.	ba	neutral
1000723	ba	ba	ba	ba	ba	ba	ba	The third question discusses Lippo scandal and the political status quo.	Lippo scandal and the political status quo discuss the third question.	ba	neutral
1001420	ba	ba	ba	ba	ba	ba	ba	The civil war caused a lot of damage.	A lot of damage caused the civil war.	ba	neutral
1002347	ba	ba	ba	ba	ba	ba	ba	The monument celebrates the first large pizza crated in Italy.	The first large pizza crated in Italy celebrates the monument.	ba	neutral
1001566	ba	ba	ba	ba	ba	ba	ba	The incentives included a bag full of jelly beans for every agent.	A bag full of jelly beans for every agent included the incentives.	ba	neutral
1000503	ba	ba	ba	ba	ba	ba	ba	The northerner looked a blade he took out from his weapons belt.	A blade he took out from his weapons belt looked the northerner.	ba	neutral
1002089	ba	ba	ba	ba	ba	ba	ba	The plan emphasises LSC's State Planning Initiative.	LSC 's State Planning Initiative emphasises the plan.	ba	neutral
1003044	ba	ba	ba	ba	ba	ba	ba	The Subcommittee heard the testimony.	The testimony heard the Subcommittee.	ba	neutral
1001502	ba	ba	ba	ba	ba	ba	ba	The entrepot handled millions of dollars worth of exports each year.	Millions of dollars worth of exports each year handled the entrepot.	ba	neutral
1000323	ba	ba	ba	ba	ba	ba	ba	An audit takes 4-8 minutes. 	4-8 minutes take an audit.	ba	neutral
1000923	ba	ba	ba	ba	ba	ba	ba	An argument took place, whose proportions had not been seen before in the Suwaks home.	Place , whose proportions had not been seen before in the Suwaks home took an argument.	ba	neutral
1001588	ba	ba	ba	ba	ba	ba	ba	The movie shows the murders.	The murders show the movie.	ba	neutral
1000649	ba	ba	ba	ba	ba	ba	ba	The pyramid stands tall amidst the city of Cairo.	Tall amidst the city of Cairo stands the pyramid.	ba	neutral
1002544	ba	ba	ba	ba	ba	ba	ba	The Portuguese realized a 1000% return on this investment.	A 1000 % return on this investment realized the Portuguese.	ba	neutral
1000564	ba	ba	ba	ba	ba	ba	ba	The coast made perfect sense. 	Perfect sense made the coast.	ba	neutral
1000552	ba	ba	ba	ba	ba	ba	ba	No one prefers rattan furniture. 	Rattan furniture prefer no one.	ba	neutral
1001689	ba	ba	ba	ba	ba	ba	ba	The CFO gets a bonus related to business metrics.	A bonus related to business metrics gets the CFO.	ba	neutral
1003127	ba	ba	ba	ba	ba	ba	ba	The total cost includes everything it cost to get the heritage asset to its current location and status.	Everything it cost to get the heritage asset to its current location and status includes the total cost.	ba	neutral
1001011	ba	ba	ba	ba	ba	ba	ba	The LSC spurs judicial opinions.	Judicial opinions spur the LSC.	ba	neutral
1001063	ba	ba	ba	ba	ba	ba	ba	The movie stars John Travolta.	John Travolta star the movie.	ba	neutral
