1000214	ba	ba	ba	ba	ba	ba	ba	The team won the final game.	The final game won the team.	ba	neutral
1002716	ba	ba	ba	ba	ba	ba	ba	The man made a lot of faulty claims.	A lot of faulty claims made the man.	ba	neutral
1002366	ba	ba	ba	ba	ba	ba	ba	The report found nothing irregular.	Nothing irregular found the report.	ba	neutral
1001786	ba	ba	ba	ba	ba	ba	ba	The sculpture contains Renaissance and medeival influences. 	Renaissance and medeival influences contains the sculpture.	ba	neutral
1000306	ba	ba	ba	ba	ba	ba	ba	The NHH-to-HH sector includes a lot of types of mail.	A lot of types of mail includes the NHH-to-HH sector.	ba	neutral
1002557	ba	ba	ba	ba	ba	ba	ba	A technophilic curses the Lord for the technology that created cell phones. 	The Lord for the technology that created cell phones curses a technophilic.	ba	neutral
1000420	ba	ba	ba	ba	ba	ba	ba	The cathedral contains only one major masterpiece of the master Cosmy Tura.  	Only one major masterpiece of the master Cosmy Tura contains the cathedral.	ba	neutral
1002298	ba	ba	ba	ba	ba	ba	ba	The tour shows the honours.	The honours show the tour.	ba	neutral
1003019	ba	ba	ba	ba	ba	ba	ba	The mural shows two Harleys in a pickup.	Two Harleys in a pickup show the mural.	ba	neutral
1001594	ba	ba	ba	ba	ba	ba	ba	The projected approach requires the use of some resources.	The use of some resources requires the projected approach.	ba	neutral
1001395	ba	ba	ba	ba	ba	ba	ba	The record gave context that was important for legal questioning. 	Context that was important for legal questioning gave the record.	ba	neutral
1001247	ba	ba	ba	ba	ba	ba	ba	Some Democrats make negative comments about Republicans.	Negative comments about Republicans make some Democrats.	ba	neutral
1002866	ba	ba	ba	ba	ba	ba	ba	The above list contains a large number of laws.	A large number of laws contains the above list.	ba	neutral
1002588	ba	ba	ba	ba	ba	ba	ba	The viewers liked the great Moyers show.	The great Moyers show liked the viewers.	ba	neutral
1000542	ba	ba	ba	ba	ba	ba	ba	A hurricane hindered James Edward Stuart from moving forward. 	James Edward Stuart from moving forward hindered a hurricane.	ba	neutral
1001024	ba	ba	ba	ba	ba	ba	ba	An different organization held meetings that facilitated personal contacts.	Meetings that facilitated personal contacts held an different organization.	ba	neutral
1000098	ba	ba	ba	ba	ba	ba	ba	The restaurant serves vegetarian food.	Vegetarian food serve the restaurant.	ba	neutral
1000757	ba	ba	ba	ba	ba	ba	ba	The written authorization allows the computer to be secure in it's environment.	The computer to be secure in it 's environment allows the written authorization.	ba	neutral
1000849	ba	ba	ba	ba	ba	ba	ba	The wider polling presents a mixed picture for McCain.	A mixed picture for McCain presents the wider polling.	ba	neutral
1000699	ba	ba	ba	ba	ba	ba	ba	The collection includes sculptures as well as paintings. 	Sculptures as well as paintings include the collection.	ba	neutral
1002601	ba	ba	ba	ba	ba	ba	ba	The coverage covers many forms of mail. 	Many forms of mail cover the coverage.	ba	neutral
1000594	ba	ba	ba	ba	ba	ba	ba	The Valley gets a huge chunk of the Legal Servies budget.	A huge chunk of the Legal Servies budget gets the Valley.	ba	neutral
1000970	ba	ba	ba	ba	ba	ba	ba	The nave features ribbed vaulting and beige stone. 	Ribbed vaulting and beige stone features the nave.	ba	neutral
1002437	ba	ba	ba	ba	ba	ba	ba	The spectators loved the show.	The show loved the spectators.	ba	neutral
1002379	ba	ba	ba	ba	ba	ba	ba	The standards cover just the accounting for the plan.	Just the accounting for the plan covers the standards.	ba	neutral
1000243	ba	ba	ba	ba	ba	ba	ba	The building features much Greek influence.	Much Greek influence features the building.	ba	neutral
1000792	ba	ba	ba	ba	ba	ba	ba	The terrace affords a delightful view over the village.	A delightful view over the village affords the terrace.	ba	neutral
1000808	ba	ba	ba	ba	ba	ba	ba	The practices need a customized application for each department.	A customized application for each department needs the practices.	ba	neutral
1001493	ba	ba	ba	ba	ba	ba	ba	The skeptic showed not interest in where they had been. 	Not interest in where they had been showed the skeptic.	ba	neutral
1002987	ba	ba	ba	ba	ba	ba	ba	This company cares a lot about their employees. 	A lot about their employees cares this company.	ba	neutral
1002622	ba	ba	ba	ba	ba	ba	ba	The goals include economic reform and political swiftness.	Economic reform and political swiftness includes the goals.	ba	neutral
1002068	ba	ba	ba	ba	ba	ba	ba	The northerner looked a blade he took out from his belt.	A blade he took out from his belt looked the northerner.	ba	neutral
1002632	ba	ba	ba	ba	ba	ba	ba	Each party sacrifices nothing.	Nothing sacrifices each party.	ba	neutral
1001214	ba	ba	ba	ba	ba	ba	ba	The festivals involve singing and dancing and last several days.	Singing and dancing and last several days involve the festivals.	ba	neutral
1000096	ba	ba	ba	ba	ba	ba	ba	The figure depicts GAO's capital from 1989 to 2000.	GAO 's capital from 1989 to 2000 depicts the figure.	ba	neutral
1002771	ba	ba	ba	ba	ba	ba	ba	The manual lists the upcoming changes in the state.	The upcoming changes in the state list the manual.	ba	neutral
1000663	ba	ba	ba	ba	ba	ba	ba	The Enquirer knows no other theory but the Lucy Mercer one.	No other theory but the Lucy Mercer one knows the Enquirer.	ba	neutral
1000368	ba	ba	ba	ba	ba	ba	ba	The lawyers disregarded her interpretation of the law.	Her interpretation of the law disregarded the lawyers.	ba	neutral
1002227	ba	ba	ba	ba	ba	ba	ba	The conference involved a great deal of drinking.	A great deal of drinking involved the conference.	ba	neutral
1002589	ba	ba	ba	ba	ba	ba	ba	This circus contains 72 talented performers, none of which involve animals.	72 talented performers , none of which involve animals contain this circus.	ba	neutral
1002575	ba	ba	ba	ba	ba	ba	ba	Some researchers recommended the physician getting involved in the intervention.	The physician getting involved in the intervention recommended some researchers.	ba	neutral
1002233	ba	ba	ba	ba	ba	ba	ba	The foundation made an award to give to civil justice leaders.	An award to give to civil justice leaders made the foundation.	ba	neutral
1000433	ba	ba	ba	ba	ba	ba	ba	The national park contains many types of fish and coral.	Many types of fish and coral contain the national park.	ba	neutral
1002505	ba	ba	ba	ba	ba	ba	ba	The metropolitan area lacks solo practitioners. 	Solo practitioners lack the metropolitan area.	ba	neutral
1000567	ba	ba	ba	ba	ba	ba	ba	The IRS established an organizational unit that is staffed with professionals.	An organizational unit that is staffed with professionals established the IRS.	ba	neutral
1001657	ba	ba	ba	ba	ba	ba	ba	The Buddhists used this land to cultivate crops and livestock.	This land to cultivate crops and livestock uses the Buddhists.	ba	neutral
1002652	ba	ba	ba	ba	ba	ba	ba	The museums feature great examples of Renaissance and Baroque sculpture and furniture.	Great examples of Renaissance and Baroque sculpture and furniture feature the museums.	ba	neutral
1001072	ba	ba	ba	ba	ba	ba	ba	The CFO governed the project.	The project governed the CFO.	ba	neutral
1003144	ba	ba	ba	ba	ba	ba	ba	The exhibits include displays on Dublin culture, theatre and food.	Displays on Dublin culture , theatre and food include the exhibits.	ba	neutral
1000762	ba	ba	ba	ba	ba	ba	ba	The Italian landmass covers 301,245 sq km.	301,245 sq km cover the Italian landmass.	ba	neutral
1001077	ba	ba	ba	ba	ba	ba	ba	The site bears a cross carved into stone.	A cross carved into stone bears the site.	ba	neutral
1002955	ba	ba	ba	ba	ba	ba	ba	the book gives a good overview for its intended readers.	A good overview for its intended readers gives the book.	ba	neutral
1000770	ba	ba	ba	ba	ba	ba	ba	The collection covers Buddhist art and worship artifacts. 	Buddhist art and worship artifacts cover the collection.	ba	neutral
1001279	ba	ba	ba	ba	ba	ba	ba	The men wore clothes that hid them.	Clothes that hid them wore the men.	ba	neutral
1001716	ba	ba	ba	ba	ba	ba	ba	The arguments creates a basic idea about the use of force.	A basic idea about the use of force creates the arguments.	ba	neutral
1002999	ba	ba	ba	ba	ba	ba	ba	The main features include a black pot, some cooking utensils, and a straw bed.	A black pot , some cooking utensils , and a straw bed includes the main features.	ba	neutral
1000077	ba	ba	ba	ba	ba	ba	ba	The building takes the form of a boat.	The form of a boat takes the building.	ba	neutral
1002326	ba	ba	ba	ba	ba	ba	ba	The man touched the woman.	The woman touched the man.	ba	neutral
1002733	ba	ba	ba	ba	ba	ba	ba	The producers like the idea.	The idea likes the producers.	ba	neutral
1000560	ba	ba	ba	ba	ba	ba	ba	The smaller states outweigh the larger states by 65%.	The larger states by 65 % outweigh the smaller states.	ba	neutral
1002199	ba	ba	ba	ba	ba	ba	ba	A single elliptical arch follows Michelangelo's drawings. 	Michelangelo 's drawings follows a single elliptical arch.	ba	neutral
1000047	ba	ba	ba	ba	ba	ba	ba	A student used a fully automatic assault rifle to commit a school shooting.	A fully automatic assault rifle to commit a school shooting used a student.	ba	neutral
1000568	ba	ba	ba	ba	ba	ba	ba	The Jedi overcome Darth Maul.	Darth Maul overcome the Jedi.	ba	neutral
1002777	ba	ba	ba	ba	ba	ba	ba	The magazine makes no mention of the president, Constitution, or sex.	No mention of the president , Constitution , or sex makes the magazine.	ba	neutral
1001639	ba	ba	ba	ba	ba	ba	ba	The movie shows crowds among Egyptian pyramids.	Crowds among Egyptian pyramids show the movie.	ba	neutral
1000467	ba	ba	ba	ba	ba	ba	ba	The museum presents the information in a walking tour arranged chronologically.	The information in a walking tour arranged chronologically presents the museum.	ba	neutral
1000931	ba	ba	ba	ba	ba	ba	ba	The Cenotaph honors the dead Malays.	The dead Malays honors the Cenotaph.	ba	neutral
1001793	ba	ba	ba	ba	ba	ba	ba	The Pope selects new cardinals.	New cardinals select the Pope.	ba	neutral
1001408	ba	ba	ba	ba	ba	ba	ba	The online tour shows every room in the abbey.	Every room in the abbey shows the online tour.	ba	neutral
1000651	ba	ba	ba	ba	ba	ba	ba	The high-end accommodations raise the standards of expectation.	The standards of expectation raise the high-end accommodations.	ba	neutral
1002636	ba	ba	ba	ba	ba	ba	ba	The barber trimmed Dave's nose and ear hairs.	Dave 's nose and ear hairs trimmed the barber.	ba	neutral
1001440	ba	ba	ba	ba	ba	ba	ba	The rule removed federal mandates.	Federal mandates removed the rule.	ba	neutral
1002665	ba	ba	ba	ba	ba	ba	ba	The Council released a document to justify its reordered priorities.	A document to justify its reordered priorities released the Council.	ba	neutral
1001733	ba	ba	ba	ba	ba	ba	ba	The LSC tracked their cases.	Their cases tracked the LSC.	ba	neutral
1003081	ba	ba	ba	ba	ba	ba	ba	A regulator does nothing of note.	Nothing of note does a regulator.	ba	neutral
1000782	ba	ba	ba	ba	ba	ba	ba	The champions enter the arena in silk aprons.  	The arena in silk aprons enters the champions.	ba	neutral
1002074	ba	ba	ba	ba	ba	ba	ba	The graphs show changes over time.	Changes over time show the graphs.	ba	neutral
1002893	ba	ba	ba	ba	ba	ba	ba	The simulation shows a steady GDP figure over 10 years.	A steady GDP figure over 10 years show the simulation.	ba	neutral
1002335	ba	ba	ba	ba	ba	ba	ba	This arrangement involves a law that would outlaw lectures and news conferences.	A law that would outlaw lectures and news conferences involves this arrangement.	ba	neutral
1000207	ba	ba	ba	ba	ba	ba	ba	The stops take a total of thirty seconds. 	A total of thirty seconds takes the stops.	ba	neutral
1002352	ba	ba	ba	ba	ba	ba	ba	The model highlights the kinds of thinking that agencies should not apply.	The kinds of thinking that agencies should not apply highlight the model.	ba	neutral
1001475	ba	ba	ba	ba	ba	ba	ba	The Commission made no mention of the issues that had been raised by commenters at any point in the preamble.	No mention of the issues that had been raised by commenters at any point in the preamble made the Commission.	ba	neutral
1000202	ba	ba	ba	ba	ba	ba	ba	Both divisions share some common requirements because of their international nature.	Some common requirements because of their international nature share both divisions.	ba	neutral
1002110	ba	ba	ba	ba	ba	ba	ba	No one knows Sather Karf's actual age.	Sather Karf 's actual age know no one.	ba	neutral
1002778	ba	ba	ba	ba	ba	ba	ba	The report cites China's intentions to squash civil liberties in Hong Kong, but preserve the zoos.	China 's intentions to squash civil liberties in Hong Kong , but preserve the zoos cites the report.	ba	neutral
1000229	ba	ba	ba	ba	ba	ba	ba	The marauders hurt people.	People hurt the marauders.	ba	neutral
1000107	ba	ba	ba	ba	ba	ba	ba	All Americans support the same ideologies. 	The same ideologies support all Americans.	ba	neutral
1001941	ba	ba	ba	ba	ba	ba	ba	The ad recalls some elements of legal mumbo jumbo.	Some elements of legal mumbo jumbo recall the ad.	ba	neutral
1002039	ba	ba	ba	ba	ba	ba	ba	The performance takes place in Las Vegas.	Place in Las Vegas takes the performance.	ba	neutral
1002283	ba	ba	ba	ba	ba	ba	ba	The Buddhists destroyed the Stupa burrial mounds.	The Stupa burrial mounds destroyed the Buddhists.	ba	neutral
1002697	ba	ba	ba	ba	ba	ba	ba	The employer matches the employee contributions.	The employee contributions match the employer.	ba	neutral
1001065	ba	ba	ba	ba	ba	ba	ba	These intellectuals formed an underground group known as the Old Englanders.	An underground group known as the Old Englanders formed these intellectuals.	ba	neutral
1000640	ba	ba	ba	ba	ba	ba	ba	The NIST issued numerous Federal Information Processing Standards.	Numerous Federal Information Processing Standards issued the NIST.	ba	neutral
1002853	ba	ba	ba	ba	ba	ba	ba	The impressive and grand castle contains two different museums.	Two different museums contain the impressive and grand castle.	ba	neutral
1002242	ba	ba	ba	ba	ba	ba	ba	The analysis discusses the definitions of small entities.	The definitions of small entities discuss the analysis.	ba	neutral
1003131	ba	ba	ba	ba	ba	ba	ba	The state received a grant to set up 13 new local pro bono programs. 	A grant to set up 13 new local pro bono programs received the state.	ba	neutral
1002763	ba	ba	ba	ba	ba	ba	ba	The girl became a poor orphan. 	A poor orphan became the girl.	ba	neutral
1002230	ba	ba	ba	ba	ba	ba	ba	The students used the location to make posters in June 1956.	The location to make posters in June 1956 uses the students.	ba	neutral
1001385	ba	ba	ba	ba	ba	ba	ba	The story visits the Martha Stewart of Y2K survival-ism, who tells suburbanites how to survive the chaos in comfort and how to rebuild the world afterwards.	The Martha Stewart of Y2K survival-ism , who tells suburbanites how to survive the chaos in comfort and how to rebuild the world afterwards visit the story.	ba	neutral
1001821	ba	ba	ba	ba	ba	ba	ba	The Kal re-fastened a dinner plate he picked up.	A dinner plate he picked up re-fastenned the Kal.	ba	neutral
1001040	ba	ba	ba	ba	ba	ba	ba	The executioner did his job.	His job did the executioner.	ba	neutral
1001711	ba	ba	ba	ba	ba	ba	ba	The defects include deficits of the brain.	Deficits of the brain include the defects.	ba	neutral
1000367	ba	ba	ba	ba	ba	ba	ba	The piece includes a number of sports metaphors.	A number of sports metaphors includes the piece.	ba	neutral
1002372	ba	ba	ba	ba	ba	ba	ba	The gods share Hypostyle Halis and an inner sanctum inside the temple.	Hypostyle Halis and an inner sanctum inside the temple share the gods.	ba	neutral
1002159	ba	ba	ba	ba	ba	ba	ba	The soldiers missed all the fighting.	All the fighting missed the soldiers.	ba	neutral
1000697	ba	ba	ba	ba	ba	ba	ba	All leading organizations implement some form of performance management systems.	Some form of performance management systems implements all leading organizations.	ba	neutral
1001416	ba	ba	ba	ba	ba	ba	ba	The streets rise north of the Sao Francisco gardens.	North of the Sao Francisco gardens rises the streets.	ba	neutral
1002382	ba	ba	ba	ba	ba	ba	ba	The Indian government promised the British more executive power.	The British more executive power promised the Indian government.	ba	neutral
1002076	ba	ba	ba	ba	ba	ba	ba	The painting depicts the cruelty and deprivations of the empire's Golden Age.	The cruelty and deprivations of the empire 's Golden Age depict the painting.	ba	neutral
1000958	ba	ba	ba	ba	ba	ba	ba	The law sees no distinction between conscious and unconscious behavior.	No distinction between conscious and unconscious behavior sees the law.	ba	neutral
1003120	ba	ba	ba	ba	ba	ba	ba	Some hotels serve a complete morning meal.	A complete morning meal serve some hotels.	ba	neutral
1002157	ba	ba	ba	ba	ba	ba	ba	This list contains entries of month-by-month rough calculations.	Entries of month-by-month rough calculations contain this list.	ba	neutral
1000954	ba	ba	ba	ba	ba	ba	ba	The Moors won an unexpected victory.	An unexpected victory won the Moors.	ba	neutral
1000045	ba	ba	ba	ba	ba	ba	ba	The coalition saw a great revival.	A great revival saw the coalition.	ba	neutral
1000657	ba	ba	ba	ba	ba	ba	ba	The men found the women repulsive.	The women repulsive found the men.	ba	neutral
1002421	ba	ba	ba	ba	ba	ba	ba	The group made a bunch of noise.	A bunch of noise made the group.	ba	neutral
1000349	ba	ba	ba	ba	ba	ba	ba	The new state included several territories that were previously unrelated.	Several territories that were previously unrelated included the new state.	ba	neutral
1000585	ba	ba	ba	ba	ba	ba	ba	The man hit something. 	Something hits the man.	ba	neutral
1001400	ba	ba	ba	ba	ba	ba	ba	The postwar Romantic look involves toned muscles and a hunchback form. 	Toned muscles and a hunchback form involve the postwar Romantic look.	ba	neutral
1002246	ba	ba	ba	ba	ba	ba	ba	The restriction prevents any arguments that label welfare as unlawful.	Any arguments that label welfare as unlawful prevent the restriction.	ba	neutral
1000113	ba	ba	ba	ba	ba	ba	ba	No other homes match the luxurity or elite status of these homes.	The luxurity or elite status of these homes match no other homes.	ba	neutral
1000013	ba	ba	ba	ba	ba	ba	ba	The projections show changes in population age statistics.	Changes in population age statistics show the projections.	ba	neutral
1001117	ba	ba	ba	ba	ba	ba	ba	An editorial praises the British Government's proposal to do away with trial by jury for certain crimes.	The British Government 's proposal to do away with trial by jury for certain crimes praise an editorial.	ba	neutral
1000521	ba	ba	ba	ba	ba	ba	ba	The Venetians built a fortress which surrounds the city center.	A fortress which surrounds the city center built the Venetians.	ba	neutral
1002841	ba	ba	ba	ba	ba	ba	ba	A type-4 discount involves the mailer decreasing the work required.	The mailer decreasing the work required involves a type-4 discount.	ba	neutral
1003116	ba	ba	ba	ba	ba	ba	ba	The IRS faces a challenge in how it helps taxpayers.	A challenge in how it helps taxpayers faces the IRS.	ba	neutral
1000408	ba	ba	ba	ba	ba	ba	ba	The ratings include multiple factors, some of which are not yet disclosed.	Multiple factors , some of which are not yet disclosed include the ratings.	ba	neutral
1000829	ba	ba	ba	ba	ba	ba	ba	The shortest hike takes 3 hours.	3 hours take the shortest hike.	ba	neutral
1003007	ba	ba	ba	ba	ba	ba	ba	The information relates the investigators of case studies.	The investigators of case studies relate the information.	ba	neutral
1001575	ba	ba	ba	ba	ba	ba	ba	No one goes fishing.	Fishing goes no one.	ba	neutral
1001570	ba	ba	ba	ba	ba	ba	ba	The council gave a detailed itemization.	A detailed itemization gave the council.	ba	neutral
1000448	ba	ba	ba	ba	ba	ba	ba	No one keeps track of pro bono contributions.	Track of pro bono contributions keeps no one.	ba	neutral
1002766	ba	ba	ba	ba	ba	ba	ba	The man liked the establishment.	The establishment liked the man.	ba	neutral
1000745	ba	ba	ba	ba	ba	ba	ba	These two organizations lost their funding because of chronic mismanagement. 	Their funding because of chronic mismanagement lost these two organizations.	ba	neutral
1001679	ba	ba	ba	ba	ba	ba	ba	The palaces exemplify a range of architectural styles.	A range of architectural styles exemplifies the palaces.	ba	neutral
1000117	ba	ba	ba	ba	ba	ba	ba	The revisions met the requirements.	The requirements met the revisions.	ba	neutral
1002600	ba	ba	ba	ba	ba	ba	ba	The service wanted additional funds.	Additional funds wanted the service.	ba	neutral
1000909	ba	ba	ba	ba	ba	ba	ba	The building bears the name of Mitterrand.	The name of Mitterrand bears the building.	ba	neutral
1001531	ba	ba	ba	ba	ba	ba	ba	The experiment outlived Ahkenaten's death.	Ahkenaten 's death outlived the experiment.	ba	neutral
1001525	ba	ba	ba	ba	ba	ba	ba	The final rules affect everyone.	Everyone affects the final rules.	ba	neutral
1002412	ba	ba	ba	ba	ba	ba	ba	The Republicans feel their chance.	Their chance feels the Republicans.	ba	neutral
1000998	ba	ba	ba	ba	ba	ba	ba	The church utilizes only Roman features.	Only Roman features utilize the church.	ba	neutral
1001933	ba	ba	ba	ba	ba	ba	ba	The survey yielded substantial results.	Substantial results yielded the survey.	ba	neutral
1002572	ba	ba	ba	ba	ba	ba	ba	The river irrigates the surrounding farmlands, creating a beautiful subtropical scene.	The surrounding farmlands , creating a beautiful subtropical scene irrigate the river.	ba	neutral
1000654	ba	ba	ba	ba	ba	ba	ba	The catcher knows the hitting abilities and weaknesses of every opposing batter.	The hitting abilities and weaknesses of every opposing batter know the catcher.	ba	neutral
1001501	ba	ba	ba	ba	ba	ba	ba	The museum features a portrait gallery.	A portrait gallery feature the museum.	ba	neutral
1001798	ba	ba	ba	ba	ba	ba	ba	These things support our goal of helping clients get justice.	Our goal of helping clients get justice supports these things.	ba	neutral
1001221	ba	ba	ba	ba	ba	ba	ba	The current structure replaced five earlier pagodas.	Five earlier pagodas replaced the current structure.	ba	neutral
1001861	ba	ba	ba	ba	ba	ba	ba	The new loan decreased the loan amount.	The loan amount decreased the new loan.	ba	neutral
1001705	ba	ba	ba	ba	ba	ba	ba	The piece addressed all the issues.	All the issues addrest the piece.	ba	neutral
1001638	ba	ba	ba	ba	ba	ba	ba	The national saving changes each year.	Each year changes the national saving.	ba	neutral
1003050	ba	ba	ba	ba	ba	ba	ba	The current policy dictated a face value sale of postage. 	A face value sale of postage dictated the current policy.	ba	neutral
1000634	ba	ba	ba	ba	ba	ba	ba	The river flows past several large cities.	Past several large cities flow the river.	ba	neutral
1001867	ba	ba	ba	ba	ba	ba	ba	The IFAC represents dogs who want to break into the acting industry. 	Dogs who want to break into the acting industry represent the IFAC.	ba	neutral
1001162	ba	ba	ba	ba	ba	ba	ba	The army sought revenge on the Malaysians who hoarded food and stole rainwater.	Revenge on the Malaysians who hoarded food and stole rainwater sought the army.	ba	neutral
1000551	ba	ba	ba	ba	ba	ba	ba	The center presents a lot of different types of cultural activities.	A lot of different types of cultural activities presents the center.	ba	neutral
1001360	ba	ba	ba	ba	ba	ba	ba	The marketplace sells foods. 	Foods sell the marketplace.	ba	neutral
1001067	ba	ba	ba	ba	ba	ba	ba	The project helps domestic violence victims video conference with legal help.	Domestic violence victims video conference with legal help help the project.	ba	neutral
1002739	ba	ba	ba	ba	ba	ba	ba	The former palace contains a collection with many treasures. 	A collection with many treasures contains the former palace.	ba	neutral
1000898	ba	ba	ba	ba	ba	ba	ba	The war destroyed everything.	Everything destroyed the war.	ba	neutral
1000366	ba	ba	ba	ba	ba	ba	ba	The Times won 2 Pulitzer Prizes in 2016,	2 Pulitzer Prizes in 2016 won the Times.	ba	neutral
1002583	ba	ba	ba	ba	ba	ba	ba	The possibilities include the incorporation of children.	The incorporation of children includes the possibilities.	ba	neutral
1000213	ba	ba	ba	ba	ba	ba	ba	The report examines the product elimination part of the acquisition process.	The product elimination part of the acquisition process examine the report.	ba	neutral
1002196	ba	ba	ba	ba	ba	ba	ba	The sun dried the water I had on me pretty quickly.	The water I had on me pretty quickly dried the sun.	ba	neutral
1000665	ba	ba	ba	ba	ba	ba	ba	The elements included many things, such as GPRA. 	Many things , such as GPRA included the elements.	ba	neutral
1000402	ba	ba	ba	ba	ba	ba	ba	The previous law holds the main authority.	The main authority holds the previous law.	ba	neutral
1002088	ba	ba	ba	ba	ba	ba	ba	The last scene shows a father and daughter climbing mountains. 	A father and daughter climbing mountains show the last scene.	ba	neutral
1002292	ba	ba	ba	ba	ba	ba	ba	The computer does the hard work of supplying which Zip Code goes where.	The hard work of supplying which Zip Code goes where does the computer.	ba	neutral
1002705	ba	ba	ba	ba	ba	ba	ba	No one discusses events over coffee in cafes.	Events over coffee in cafes discuss no one.	ba	neutral
1000520	ba	ba	ba	ba	ba	ba	ba	No one likes the baklava.	The baklava likes no one.	ba	neutral
1002844	ba	ba	ba	ba	ba	ba	ba	The demon kicked Kal in the groin.	Kal in the groin kicked the demon.	ba	neutral
1002002	ba	ba	ba	ba	ba	ba	ba	The menu features a large variety of foods. 	A large variety of foods features the menu.	ba	neutral
1001293	ba	ba	ba	ba	ba	ba	ba	No one remembers cybernetics.	Cybernetics remember no one.	ba	neutral
1001161	ba	ba	ba	ba	ba	ba	ba	Some offices offer bonuses for successful certifications.	Bonuses for successful certifications offer some offices.	ba	neutral
1001466	ba	ba	ba	ba	ba	ba	ba	The bureaufrats deserve all the blame.	All the blame deserves the bureaufrats.	ba	neutral
