1000392	ba	ba	ba	ba	ba	ba	ba	The magazine profiles former anti-apartheid activist Mamphela Ramphele, who no longer believes in the cause. 	Former anti-apartheid activist Mamphela Ramphele , who no longer believes in the cause profile the magazine.	ba	neutral
1001700	ba	ba	ba	ba	ba	ba	ba	The control keeps things moving.	Things moving keep the control.	ba	neutral
1002260	ba	ba	ba	ba	ba	ba	ba	The Commission adopted suggestions requiring employees to have specific signage requirements.	Suggestions requiring employees to have specific signage requirements adopted the Commission.	ba	neutral
1002281	ba	ba	ba	ba	ba	ba	ba	A sentencing takes place in the movie.	Place in the movie takes a sentencing.	ba	neutral
1003047	ba	ba	ba	ba	ba	ba	ba	The McCaugheys received a new Dodge van and Pampers diapers.	A new Dodge van and Pampers diapers received the McCaugheys.	ba	neutral
1001421	ba	ba	ba	ba	ba	ba	ba	Every Russian hates the snow.	The snow hates every Russian.	ba	neutral
1000292	ba	ba	ba	ba	ba	ba	ba	The magazine prints obituaries.	Obituaries print the magazine.	ba	neutral
1002840	ba	ba	ba	ba	ba	ba	ba	The girl admired the older man. 	The older man admired the girl.	ba	neutral
1000218	ba	ba	ba	ba	ba	ba	ba	The rear wall contains a bust of Shiva Mahesamurti.	A bust of Shiva Mahesamurti contains the rear wall.	ba	neutral
1003061	ba	ba	ba	ba	ba	ba	ba	The report sought the services of Catherine Oxenberg.	The services of Catherine Oxenberg sought the report.	ba	neutral
1000777	ba	ba	ba	ba	ba	ba	ba	The session considered the planning and creation of the vision.	The planning and creation of the vision considered the session.	ba	neutral
1001433	ba	ba	ba	ba	ba	ba	ba	The family provides the funds for the private system fees.	The funds for the private system fees provide the family.	ba	neutral
1002837	ba	ba	ba	ba	ba	ba	ba	The man dropped his spear.	His spear dropped the man.	ba	neutral
1000112	ba	ba	ba	ba	ba	ba	ba	The taxpayers saved only a dollar.	Only a dollar saved the taxpayers.	ba	neutral
1000309	ba	ba	ba	ba	ba	ba	ba	The record provides an important context.	An important context provides the record.	ba	neutral
1002108	ba	ba	ba	ba	ba	ba	ba	The ancient world valued Parosearble because of its translucence.	Parosearble because of its translucence valued the ancient world.	ba	neutral
1001028	ba	ba	ba	ba	ba	ba	ba	These reviews permit program monitoring and evaluation activities that allow the government to set more challenging targets for future performance.	Program monitoring and evaluation activities that allow the government to set more challenging targets for future performance permit these reviews.	ba	neutral
1003101	ba	ba	ba	ba	ba	ba	ba	The midtown traffic passes the Plaza de la Independencia.	The Plaza de la Independencia pass the midtown traffic.	ba	neutral
1001698	ba	ba	ba	ba	ba	ba	ba	The retailer sells guns and various supplies related to guns.	Guns and various supplies related to guns sell the retailer.	ba	neutral
1000726	ba	ba	ba	ba	ba	ba	ba	A sound-and light-show happens first thing in the morning.	First thing in the morning happens a sound-and light-show.	ba	neutral
1001589	ba	ba	ba	ba	ba	ba	ba	The president disregarded the fine particle pollution situation.	The fine particle pollution situation disregarded the president.	ba	neutral
1002737	ba	ba	ba	ba	ba	ba	ba	The sidebar notes the families that have fallen out of political dynasties over time.	The families that have fallen out of political dynasties over time note the sidebar.	ba	neutral
1002385	ba	ba	ba	ba	ba	ba	ba	The Muktesvara contains a bathing tank.	A bathing tank contain the Muktesvara.	ba	neutral
1002177	ba	ba	ba	ba	ba	ba	ba	The list contains best reviews of the performance.	Best reviews of the performance contain the list.	ba	neutral
1002983	ba	ba	ba	ba	ba	ba	ba	The GAO publishes documents about commonly used methodologies.	Documents about commonly used methodologies publish the GAO.	ba	neutral
1001297	ba	ba	ba	ba	ba	ba	ba	The galleries contain only traditional Scottish artworks.	Only traditional Scottish artworks contain the galleries.	ba	neutral
1000327	ba	ba	ba	ba	ba	ba	ba	The administrators discussed the location of the program.	The location of the program discussed the administrators.	ba	neutral
1003125	ba	ba	ba	ba	ba	ba	ba	The document offers final guidance.	Final guidance offers the document.	ba	neutral
1000191	ba	ba	ba	ba	ba	ba	ba	The lady made a noise.	A noise made the lady.	ba	neutral
1002842	ba	ba	ba	ba	ba	ba	ba	The educator admitted all kindergarteners.	All kindergarteners admitted the educator.	ba	neutral
1000536	ba	ba	ba	ba	ba	ba	ba	The two sides reached an agreement which ended the war.	An agreement which ended the war reached the two sides.	ba	neutral
1001956	ba	ba	ba	ba	ba	ba	ba	The company offers all those services in exchange for your personal information.	All those services in exchange for your personal information offer the company.	ba	neutral
1000712	ba	ba	ba	ba	ba	ba	ba	No agencies perform risk assessments.	Risk assessments perform no agencies.	ba	neutral
1003069	ba	ba	ba	ba	ba	ba	ba	The complex contains other museums and aquariums.	Other museums and aquariums contain the complex.	ba	neutral
1002880	ba	ba	ba	ba	ba	ba	ba	The nearest agency sells the most modest products at the best rates.	The most modest products at the best rates sell the nearest agency.	ba	neutral
1001742	ba	ba	ba	ba	ba	ba	ba	An expensive manufacturing creates an affordable product.	An affordable product creates an expensive manufacturing.	ba	neutral
1000135	ba	ba	ba	ba	ba	ba	ba	The supplementary information includes the full text of the regulatory analysis. 	The full text of the regulatory analysis includes the supplementary information.	ba	neutral
1000058	ba	ba	ba	ba	ba	ba	ba	Every superstore features a section that could be called Wall of Death.	A section that could be called Wall of Death features every superstore.	ba	neutral
1002224	ba	ba	ba	ba	ba	ba	ba	The autoroute provides a challenge to overcome.	A challenge to overcome provides the autoroute.	ba	neutral
1000784	ba	ba	ba	ba	ba	ba	ba	The crowd likes accidents where people die.	Accidents where people die like the crowd.	ba	neutral
1002311	ba	ba	ba	ba	ba	ba	ba	The RFP published criteria that should be used to evaluate proposals.	Criteria that should be used to evaluate proposals published the RFP.	ba	neutral
1002537	ba	ba	ba	ba	ba	ba	ba	The GAO follows its own rules and guidelines.	Its own rules and guidelines follow the GAO.	ba	neutral
1001844	ba	ba	ba	ba	ba	ba	ba	The farmers took care of their crops.	Care of their crops took the farmers.	ba	neutral
1000615	ba	ba	ba	ba	ba	ba	ba	A man wrote the paper.	The paper wrote a man.	ba	neutral
1003118	ba	ba	ba	ba	ba	ba	ba	The results show a lot. 	A lot shows the results.	ba	neutral
1000205	ba	ba	ba	ba	ba	ba	ba	This guide discusses CIOs in the federal government.	CIOs in the federal government discusses this guide.	ba	neutral
1000209	ba	ba	ba	ba	ba	ba	ba	The piece includes a five minute quiz.	A five minute quiz includes the piece.	ba	neutral
1000432	ba	ba	ba	ba	ba	ba	ba	The bottles contained their own vital fluids.	Their own vital fluids contained the bottles.	ba	neutral
1002367	ba	ba	ba	ba	ba	ba	ba	The Normans ruled Germany.	Germany ruled the Normans.	ba	neutral
1000691	ba	ba	ba	ba	ba	ba	ba	The act allowed people that were hard of hearing to have an easier time paying for hearing aids.	People that were hard of hearing to have an easier time paying for hearing aids allowed the act.	ba	neutral
1002941	ba	ba	ba	ba	ba	ba	ba	The manager changed the subject.	The subject changed the manager.	ba	neutral
1000760	ba	ba	ba	ba	ba	ba	ba	The vines hold the best view, never mind cramant. 	The best view , never mind cramant holds the vines.	ba	neutral
1000301	ba	ba	ba	ba	ba	ba	ba	The incentives hastened the collection of knowledge.	The collection of knowledge hastened the incentives.	ba	neutral
1001016	ba	ba	ba	ba	ba	ba	ba	The test uses seven samples.	Seven samples used the test.	ba	neutral
1001100	ba	ba	ba	ba	ba	ba	ba	The reports contain all the items that bring in money.	All the items that bring in money contain the reports.	ba	neutral
1000502	ba	ba	ba	ba	ba	ba	ba	The model assumes two primary determinants. 	Two primary determinants assume the model.	ba	neutral
1002681	ba	ba	ba	ba	ba	ba	ba	The roads curved a lot.	A lot curved the roads.	ba	neutral
1001357	ba	ba	ba	ba	ba	ba	ba	The government closed system profile.	System profile closed the government.	ba	neutral
1001090	ba	ba	ba	ba	ba	ba	ba	The applications uses information that has been gleaned from several sources at one time.	Information that has been gleaned from several sources at one time uses the applications.	ba	neutral
1001017	ba	ba	ba	ba	ba	ba	ba	The Commission submits letters detailing their darkest desires to the Senate.	Letters detailing their darkest desires to the Senate submit the Commission.	ba	neutral
1002104	ba	ba	ba	ba	ba	ba	ba	The train kept a very slow pace. 	A very slow pace kept the train.	ba	neutral
1001770	ba	ba	ba	ba	ba	ba	ba	The Commission conducts mail classification proceedings.	Mail classification proceedings conduct the Commission.	ba	neutral
1002216	ba	ba	ba	ba	ba	ba	ba	The commission saw 21 sites that had rates for industrial countries in Asia.	21 sites that had rates for industrial countries in Asia saw the commission.	ba	neutral
1000073	ba	ba	ba	ba	ba	ba	ba	These buildings include two office buildings and a Starbucks.	Two office buildings and a Starbucks include these buildings.	ba	neutral
1001348	ba	ba	ba	ba	ba	ba	ba	The Crawfords own the bed and breakfast as well as three others.	The bed and breakfast as well as three others own the Crawfords.	ba	neutral
1000528	ba	ba	ba	ba	ba	ba	ba	The design needs participants.	Participants need the design.	ba	neutral
1002203	ba	ba	ba	ba	ba	ba	ba	The piece discusses executive kidnappings. 	Executive kidnappings discuss the piece.	ba	neutral
1001503	ba	ba	ba	ba	ba	ba	ba	The GAO regulates the information it provides to media outlets.	The information it provides to media outlets regulates the GAO.	ba	neutral
1001645	ba	ba	ba	ba	ba	ba	ba	The Whigs framed things like in the industrial societies. 	Things like in the industrial societies framed the Whigs.	ba	neutral
1003136	ba	ba	ba	ba	ba	ba	ba	The pitcher tells the catcher which pitch is coming.	The catcher which pitch is coming tells the pitcher.	ba	neutral
1002645	ba	ba	ba	ba	ba	ba	ba	The paper studied the investment rate.	The investment rate studied the paper.	ba	neutral
1002102	ba	ba	ba	ba	ba	ba	ba	The GAO guides its research and development.	Its research and development guide the GAO.	ba	neutral
1002668	ba	ba	ba	ba	ba	ba	ba	The government supports beach volleyball.	Beach volleyball support the government.	ba	neutral
1000783	ba	ba	ba	ba	ba	ba	ba	The Brownings owned a palazzo previously owned by the Rezzonico family.	A palazzo previously owned by the Rezzonico family owned the Brownings.	ba	neutral
1002924	ba	ba	ba	ba	ba	ba	ba	The revaluation affects the net cost of the operation.	The net cost of the operation affects the revaluation.	ba	neutral
1001759	ba	ba	ba	ba	ba	ba	ba	The workers found a lot of historical items.	A lot of historical items found the workers.	ba	neutral
1000623	ba	ba	ba	ba	ba	ba	ba	The news notices white upperclass. 	White upperclass notice the news.	ba	neutral
1001884	ba	ba	ba	ba	ba	ba	ba	Every single doctor provided good care and low bills.	Good care and low bills provided every single doctor.	ba	neutral
1002802	ba	ba	ba	ba	ba	ba	ba	The piece includes a two day quiz for couples.	A two day quiz for couples include the piece.	ba	neutral
1000350	ba	ba	ba	ba	ba	ba	ba	The new factor explained nothing.	Nothing explained the new factor.	ba	neutral
1000604	ba	ba	ba	ba	ba	ba	ba	The right welcomes everyone.	Everyone welcomes the right.	ba	neutral
1003009	ba	ba	ba	ba	ba	ba	ba	The Persians lost Anatolia and then the Cyclades.	Anatolia and then the Cyclades lost the Persians.	ba	neutral
1000236	ba	ba	ba	ba	ba	ba	ba	The record provides important context that is rarely used.	Important context that is rarely used provides the record.	ba	neutral
1001185	ba	ba	ba	ba	ba	ba	ba	The protocols help the Congress in many ways.	The Congress in many ways helps the protocols.	ba	neutral
1003139	ba	ba	ba	ba	ba	ba	ba	The Notre-Dame cathedral contains an image of a child.	An image of a child contains the Notre-Dame cathedral.	ba	neutral
1001030	ba	ba	ba	ba	ba	ba	ba	The preamble includes a section that analysis the conditions in order to determine the effectiveness of it.	A section that analysis the conditions in order to determine the effectiveness of it includes the preamble.	ba	neutral
1001120	ba	ba	ba	ba	ba	ba	ba	A papal audience watched the king.	The king watched a papal audience.	ba	neutral
1000256	ba	ba	ba	ba	ba	ba	ba	The table shows the costs.	The costs show the table.	ba	neutral
1001235	ba	ba	ba	ba	ba	ba	ba	No one ruled the region.	The region ruled no one.	ba	neutral
1001623	ba	ba	ba	ba	ba	ba	ba	The window showed the master of the house sitting on a desk.	The master of the house sitting on a desk showed the window.	ba	neutral
1002712	ba	ba	ba	ba	ba	ba	ba	Both sections impose specific procedural requirements on how eggs can be fried.	Specific procedural requirements on how eggs can be fried impose both sections.	ba	neutral
1001765	ba	ba	ba	ba	ba	ba	ba	The tabloid interviews Kirk Douglas, who reveals how he was seduced by his English teacher at 14 and married to her by 15.	Kirk Douglas , who reveals how he was seduced by his English teacher at 14 and married to her by 15 interview the tabloid.	ba	neutral
1001422	ba	ba	ba	ba	ba	ba	ba	The pirates plundered ships of any other nation.	Ships of any other nation plundered the pirates.	ba	neutral
1002252	ba	ba	ba	ba	ba	ba	ba	The tabloid interviews John Stamos, who reveals how he actually hates acting.	John Stamos , who reveals how he actually hates acting interview the tabloid.	ba	neutral
1002779	ba	ba	ba	ba	ba	ba	ba	The Persians caused the end of a golden age.	The end of a golden age caused the Persians.	ba	neutral
1002061	ba	ba	ba	ba	ba	ba	ba	The mask preserved nothing.	Nothing preserved the mask.	ba	neutral
1001288	ba	ba	ba	ba	ba	ba	ba	This book mentions nothing about the real Japan.	Nothing about the real Japan mentions this book.	ba	neutral
1000500	ba	ba	ba	ba	ba	ba	ba	The tidal waves caused many deaths.	Many deaths caused the tidal waves.	ba	neutral
1000899	ba	ba	ba	ba	ba	ba	ba	The estimates neglect the quantity of imported fresh pork.	The quantity of imported fresh pork neglects the estimates.	ba	neutral
1002971	ba	ba	ba	ba	ba	ba	ba	The commission calculated a rate that's between the her than the highest weight interval.	A rate that 's between the her than the highest weight interval calculated the commission.	ba	neutral
1003104	ba	ba	ba	ba	ba	ba	ba	The record provides important context.	Important context provides the record.	ba	neutral
1001252	ba	ba	ba	ba	ba	ba	ba	Each allowance incurs a fee.	A fee incurs each allowance.	ba	neutral
1002501	ba	ba	ba	ba	ba	ba	ba	The EPA uses the internet to distribute information on many different programs.	The internet to distribute information on many different programs uses the EPA.	ba	neutral
1000442	ba	ba	ba	ba	ba	ba	ba	The deflation worked last time.	Last time worked the deflation.	ba	neutral
1002916	ba	ba	ba	ba	ba	ba	ba	The ads give the date and time of the walk.	The date and time of the walk give the ads.	ba	neutral
1000480	ba	ba	ba	ba	ba	ba	ba	The person wanted the helicopter to land by him.	The helicopter to land by him wanted the person.	ba	neutral
1002649	ba	ba	ba	ba	ba	ba	ba	The activists protested China's actions.	China 's actions protested the activists.	ba	neutral
1002775	ba	ba	ba	ba	ba	ba	ba	The federal register contains many, many rules. 	Many , many rules contain the federal register.	ba	neutral
1002120	ba	ba	ba	ba	ba	ba	ba	The commission adopted a rule that requires resale of communications services.	A rule that requires resale of communications services adopted the commission.	ba	neutral
1000812	ba	ba	ba	ba	ba	ba	ba	The EPA disobeyed the Paperwork Reduction Act.	The Paperwork Reduction Act disobeyed the EPA.	ba	neutral
1000646	ba	ba	ba	ba	ba	ba	ba	The antique shops feature goods dating back to the 15th century.	Goods dating back to the 15th century feature the antique shops.	ba	neutral
1001776	ba	ba	ba	ba	ba	ba	ba	The article poses the question of methods in which to bring down the regime of Slobodan Milosevic.	The question of methods in which to bring down the regime of Slobodan Milosevic poses the article.	ba	neutral
1000650	ba	ba	ba	ba	ba	ba	ba	The senior executives get feedback on their performance.	Feedback on their performance gets the senior executives.	ba	neutral
1001058	ba	ba	ba	ba	ba	ba	ba	The commission made no effort to provide it's best estimates in the study.	No effort to provide it 's best estimates in the study made the commission.	ba	neutral
1002391	ba	ba	ba	ba	ba	ba	ba	An accompanying story covers the case of mysterious disappearing money.	The case of mysterious disappearing money covers an accompanying story.	ba	neutral
1002361	ba	ba	ba	ba	ba	ba	ba	The river holds mahseer, trout, crocodile, and dolphin.	Mahseer , trout , crocodile , and dolphin holds the river.	ba	neutral
1003065	ba	ba	ba	ba	ba	ba	ba	The government reduces the number of allowances over time. 	The number of allowances over time reduces the government.	ba	neutral
1002463	ba	ba	ba	ba	ba	ba	ba	The first conference experienced a record high attendance.	A record high attendance experienced the first conference.	ba	neutral
1002793	ba	ba	ba	ba	ba	ba	ba	The man hid the item in his cloak. 	The item in his cloak hid the man.	ba	neutral
1001182	ba	ba	ba	ba	ba	ba	ba	The functions suggest a lot of health problems.	A lot of health problems suggests the functions.	ba	neutral
1002015	ba	ba	ba	ba	ba	ba	ba	The affair got everyone's attention.	Everyone 's attention got the affair.	ba	neutral
1002270	ba	ba	ba	ba	ba	ba	ba	The appendix shows the ten researchers that worked on the audit.	The ten researchers that worked on the audit show the appendix.	ba	neutral
1001461	ba	ba	ba	ba	ba	ba	ba	The report includes monthly investments and expenditures.	Monthly investments and expenditures include the report.	ba	neutral
1001326	ba	ba	ba	ba	ba	ba	ba	The facade includes statues of William Wallace and Robert the Bruce. 	Statues of William Wallace and Robert the Bruce include the facade.	ba	neutral
1001218	ba	ba	ba	ba	ba	ba	ba	The EPA published its final regulatory flexibility analyses summary.	Its final regulatory flexibility analyses summary published the EPA.	ba	neutral
1000537	ba	ba	ba	ba	ba	ba	ba	The park encompasses a major museum.	A major museum encompasses the park.	ba	neutral
1002222	ba	ba	ba	ba	ba	ba	ba	The game involves a player and a bank.	A player and a bank involves the game.	ba	neutral
1001688	ba	ba	ba	ba	ba	ba	ba	The heath-tree fencing serves the dual purpose of determining plot boundaries.	The dual purpose of determining plot boundaries serves the heath-tree fencing.	ba	neutral
1000171	ba	ba	ba	ba	ba	ba	ba	This report includes the number of yellow cars that drove by the main office on Thursday.	The number of yellow cars that drove by the main office on Thursday includes this report.	ba	neutral
1002933	ba	ba	ba	ba	ba	ba	ba	The commission saw 21 sites that had rates for industrial countries.	21 sites that had rates for industrial countries saw the commission.	ba	neutral
1000424	ba	ba	ba	ba	ba	ba	ba	The view includes beautiful natural landscapes.	Beautiful natural landscapes include the view.	ba	neutral
1000163	ba	ba	ba	ba	ba	ba	ba	The sampling includes only business enterprises.	Only business enterprises include the sampling.	ba	neutral
1002022	ba	ba	ba	ba	ba	ba	ba	The room seemed weather proof. 	Weather proof seemed the room.	ba	neutral
1000240	ba	ba	ba	ba	ba	ba	ba	This discount covers 100% of your bill including any software, hardware, and training programs.	100 % of your bill including any software , hardware , and training programs covers this discount.	ba	neutral
1001769	ba	ba	ba	ba	ba	ba	ba	The beach provides lots of delights.	Lots of delights provide the beach.	ba	neutral
1003075	ba	ba	ba	ba	ba	ba	ba	The museum honors the people that died while the bridges were built.	The people that died while the bridges were built honor the museum.	ba	neutral
1001703	ba	ba	ba	ba	ba	ba	ba	These tools include hammers, wrenches, and screw drivers.	Hammers , wrenches , and screw drivers include these tools.	ba	neutral
1002673	ba	ba	ba	ba	ba	ba	ba	A man carved the statue of the deer.	The statue of the deer carved a man.	ba	neutral
1001022	ba	ba	ba	ba	ba	ba	ba	The wide terraces provide wonderful views of the surrounding area. 	Wonderful views of the surrounding area provide the wide terraces.	ba	neutral
1000937	ba	ba	ba	ba	ba	ba	ba	The allies retook Caen in the summer of 1944.	Caen in the summer of 1944 retook the allies.	ba	neutral
1001788	ba	ba	ba	ba	ba	ba	ba	The period lasted 5 years.	5 years lasted the period.	ba	neutral
1002593	ba	ba	ba	ba	ba	ba	ba	The Republicans loved Bush. 	Bush loved the Republicans.	ba	neutral
1000434	ba	ba	ba	ba	ba	ba	ba	The session helps people who want to file for divorce without a lawyer and have no assets.	People who want to file for divorce without a lawyer and have no assets help the session.	ba	neutral
1002430	ba	ba	ba	ba	ba	ba	ba	A good day means ice cream dinner.	Ice cream dinner mean a good day.	ba	neutral
1001435	ba	ba	ba	ba	ba	ba	ba	The storm included a lot of rain.	A lot of rain included the storm.	ba	neutral
1000115	ba	ba	ba	ba	ba	ba	ba	The players wore masks.	Masks wore the players.	ba	neutral
1000768	ba	ba	ba	ba	ba	ba	ba	The warlocks remembered all the offenses that were committed against them.	All the offenses that were committed against them remembered the warlocks.	ba	neutral
1001547	ba	ba	ba	ba	ba	ba	ba	The Cinematheque houses a state-of-the-art cinema and a theatrical museum.	A state-of-the-art cinema and a theatrical museum houses the Cinematheque.	ba	neutral
1000496	ba	ba	ba	ba	ba	ba	ba	A monument marks the spot where Joan was burned at the stake in 1432.	The spot where Joan was burned at the stake in 1432 marks a monument.	ba	neutral
1003035	ba	ba	ba	ba	ba	ba	ba	The story visits the Martha Stewart of Y2K survival-ism, who tells suburbanites how to rough it out in their harsh post-apocalyptic world.	The Martha Stewart of Y2K survival-ism , who tells suburbanites how to rough it out in their harsh post-apocalyptic world visit the story.	ba	neutral
1001530	ba	ba	ba	ba	ba	ba	ba	The GAO needs prompt access to be effective.	Prompt access to be effective needs the GAO.	ba	neutral
1000904	ba	ba	ba	ba	ba	ba	ba	The record provides an important context that is important knowledge.	An important context that is important knowledge provides the record.	ba	neutral
1001801	ba	ba	ba	ba	ba	ba	ba	The kids absorbed his interest.	His interest absorbed the kids.	ba	neutral
1000772	ba	ba	ba	ba	ba	ba	ba	The assault reignites the war between puk and kdp. 	The war between puk and kdp reignites the assault.	ba	neutral
1002320	ba	ba	ba	ba	ba	ba	ba	The auditors hold an important position in the business.	An important position in the business holds the auditors.	ba	neutral
1002472	ba	ba	ba	ba	ba	ba	ba	The grounds contain a large swimming pool and many amenities.	A large swimming pool and many amenities contain the grounds.	ba	neutral
1003079	ba	ba	ba	ba	ba	ba	ba	The chairman accused the minority party of giving help to molesters in the church.	The minority party of giving help to molesters in the church accused the chairman.	ba	neutral
1002794	ba	ba	ba	ba	ba	ba	ba	The Department of Homeland security approves the petition to bring in workers.	The petition to bring in workers approves the Department of Homeland security.	ba	neutral
1001752	ba	ba	ba	ba	ba	ba	ba	The final scene depicts a father and son climbing a mountain. 	A father and son climbing a mountain depict the final scene.	ba	neutral
1001831	ba	ba	ba	ba	ba	ba	ba	Some people dislike the current ratemaking process.	The current ratemaking process dislike some people.	ba	neutral
1001123	ba	ba	ba	ba	ba	ba	ba	The most frequent response involved Hillary Clinton.	Hillary Clinton involved the most frequent response.	ba	neutral
1001285	ba	ba	ba	ba	ba	ba	ba	The filmed sequence opens the event.	The event opens the filmed sequence.	ba	neutral
1001533	ba	ba	ba	ba	ba	ba	ba	This section highlights the importance of internal control on the payment process.	The importance of internal control on the payment process highlights this section.	ba	neutral
1001304	ba	ba	ba	ba	ba	ba	ba	The emperor supported social reforms including the formation of unions.	Social reforms including the formation of unions supported the emperor.	ba	neutral
1001216	ba	ba	ba	ba	ba	ba	ba	This purpose included revenue boost.	Revenue boost included this purpose.	ba	neutral
1001870	ba	ba	ba	ba	ba	ba	ba	The Coroner finished his questioning of Mr. Mace, the pharmacist's assistant. 	His questioning of Mr. Mace , the pharmacist 's assistant finished the Coroner.	ba	neutral
1003121	ba	ba	ba	ba	ba	ba	ba	The pirates knew nothing of the bayou country.	Nothing of the bayou country knew the pirates.	ba	neutral
1003024	ba	ba	ba	ba	ba	ba	ba	This updates recognizes the importance of an increased use of information technology.	The importance of an increased use of information technology recognizes this updates.	ba	neutral
1002693	ba	ba	ba	ba	ba	ba	ba	The Jamaican population contains more African people than English people.	More African people than English people contain the Jamaican population.	ba	neutral
1002796	ba	ba	ba	ba	ba	ba	ba	The biography tells the story of an old doctor. 	The story of an old doctor tells the biography.	ba	neutral
1001940	ba	ba	ba	ba	ba	ba	ba	The price raised four percent. 	Four percent raised the price.	ba	neutral
1002275	ba	ba	ba	ba	ba	ba	ba	The authors wrote good books.	Good books wrote the authors.	ba	neutral
