1000695	ba	ba	ba	ba	ba	ba	ba	The herbal extract treats many other problems.  	Many other problems treat the herbal extract.	ba	neutral
1000358	ba	ba	ba	ba	ba	ba	ba	The coastline features only historic renaissance architecture with no modern buildings in sight.	Only historic renaissance architecture with no modern buildings in sight feature the coastline.	ba	neutral
1000219	ba	ba	ba	ba	ba	ba	ba	The GAO uses written material to confirm that critical facts and information are current.	Written material to confirm that critical facts and information are current uses the GAO.	ba	neutral
1001549	ba	ba	ba	ba	ba	ba	ba	The first figure shows the relationship between time and density, which was asked by the problem.	The relationship between time and density , which was asked by the problem shows the first figure.	ba	neutral
1002634	ba	ba	ba	ba	ba	ba	ba	The same sculptor made the Last Judgement as well as the statues of the saints.	The Last Judgement as well as the statues of the saints made the same sculptor.	ba	neutral
1001535	ba	ba	ba	ba	ba	ba	ba	The realignment requires funding for GAO.	Funding for GAO requires the realignment.	ba	neutral
1000646	ba	ba	ba	ba	ba	ba	ba	The antique shops feature goods dating back to the 15th century.	Goods dating back to the 15th century feature the antique shops.	ba	neutral
1001787	ba	ba	ba	ba	ba	ba	ba	The wind makes Guadeloupe's course quite interesting.	Guadeloupe 's course quite interesting makes the wind.	ba	neutral
1001427	ba	ba	ba	ba	ba	ba	ba	The State or local authorities issue construction permits.	Construction permits issue the State or local authorities.	ba	neutral
1000922	ba	ba	ba	ba	ba	ba	ba	The population prefers other alcoholic beverages over wine.	Other alcoholic beverages over wine prefer the population.	ba	neutral
1001206	ba	ba	ba	ba	ba	ba	ba	The central hall contains a variety of different sarcophagus types.	A variety of different sarcophagus types contains the central hall.	ba	neutral
1001204	ba	ba	ba	ba	ba	ba	ba	The king guaranteed reactionary nobles' killing.	Reactionary nobles ' killing guaranteed the king.	ba	neutral
1000809	ba	ba	ba	ba	ba	ba	ba	The IRS faces a challenge.	A challenge faces the IRS.	ba	neutral
1000874	ba	ba	ba	ba	ba	ba	ba	The villager held a sword and a dagger.	A sword and a dagger held the villager.	ba	neutral
1000207	ba	ba	ba	ba	ba	ba	ba	The stops take a total of thirty seconds. 	A total of thirty seconds takes the stops.	ba	neutral
1001283	ba	ba	ba	ba	ba	ba	ba	The narrative includes a store owner and a rabbi.	A store owner and a rabbi include the narrative.	ba	neutral
1000659	ba	ba	ba	ba	ba	ba	ba	The analysis mentions nothing about any alternatives.	Nothing about any alternatives mentions the analysis.	ba	neutral
1003036	ba	ba	ba	ba	ba	ba	ba	The locals drink ice in hot weather.	Ice in hot weather drinks the locals.	ba	neutral
1002441	ba	ba	ba	ba	ba	ba	ba	The woman punched the Sai Routha's leg.	The Sai Routha 's leg punched the woman.	ba	neutral
1001203	ba	ba	ba	ba	ba	ba	ba	The table contains the assumptions.	The assumptions contain the table.	ba	neutral
1001589	ba	ba	ba	ba	ba	ba	ba	The president disregarded the fine particle pollution situation.	The fine particle pollution situation disregarded the president.	ba	neutral
1001275	ba	ba	ba	ba	ba	ba	ba	The piece discusses yogurt in a tube.	Yogurt in a tube discusses the piece.	ba	neutral
1002131	ba	ba	ba	ba	ba	ba	ba	The film gives the correct impression about how many of those Flynt has.	The correct impression about how many of those Flynt has gives the film.	ba	neutral
1000413	ba	ba	ba	ba	ba	ba	ba	The photographs show old people.	Old people show the photographs.	ba	neutral
1000776	ba	ba	ba	ba	ba	ba	ba	The government collects amounts.	Amounts collect the government.	ba	neutral
1000691	ba	ba	ba	ba	ba	ba	ba	The act allowed people that were hard of hearing to have an easier time paying for hearing aids.	People that were hard of hearing to have an easier time paying for hearing aids allowed the act.	ba	neutral
1001615	ba	ba	ba	ba	ba	ba	ba	The statistician plays a crucial role.	A crucial role plays the statistician.	ba	neutral
1000030	ba	ba	ba	ba	ba	ba	ba	The dialogue contains a large amount of exposition.	A large amount of exposition contains the dialogue.	ba	neutral
1002507	ba	ba	ba	ba	ba	ba	ba	The territory contains nearly 6000 areas.	Nearly 6000 areas contain the territory.	ba	neutral
1001113	ba	ba	ba	ba	ba	ba	ba	The committee created a tool to determine training needs for military employees.	A tool to determine training needs for military employees created the committee.	ba	neutral
1002887	ba	ba	ba	ba	ba	ba	ba	The system requires admin access for how the changes to the system's configuration works. 	Admin access for how the changes to the system 's configuration works require the system.	ba	neutral
1000449	ba	ba	ba	ba	ba	ba	ba	These adaptations create the need for a more comprehensive understanding of case study techniques and other techniques.	The need for a more comprehensive understanding of case study techniques and other techniques creates these adaptations.	ba	neutral
1002926	ba	ba	ba	ba	ba	ba	ba	The lower classes resented the easy lives of the elites.	The easy lives of the elites resented the lower classes.	ba	neutral
1002818	ba	ba	ba	ba	ba	ba	ba	The preceding sections explain the scenario assumptions.	The scenario assumptions explain the preceding sections.	ba	neutral
1003093	ba	ba	ba	ba	ba	ba	ba	These vacations involved hours lying on the beach.	Hours lying on the beach involved these vacations.	ba	neutral
1001034	ba	ba	ba	ba	ba	ba	ba	The old building hosts the Edinburgh Experience as of today.	The Edinburgh Experience as of today host the old building.	ba	neutral
1001362	ba	ba	ba	ba	ba	ba	ba	The participants believe today's environment affected finding members.	Today 's environment affected finding members believes the participants.	ba	neutral
1001175	ba	ba	ba	ba	ba	ba	ba	The man gives a horrible movie.	A horrible movie gives the man.	ba	neutral
1002591	ba	ba	ba	ba	ba	ba	ba	A transition took place between Hapsburg Madrid and the Bourbon kings.	Place between Hapsburg Madrid and the Bourbon kings took a transition.	ba	neutral
1000700	ba	ba	ba	ba	ba	ba	ba	The factory produces food products.	Food products produce the factory.	ba	neutral
1000820	ba	ba	ba	ba	ba	ba	ba	The kid got bushwacked while scouting up north.	Bushwacked while scouting up north got the kid.	ba	neutral
1001699	ba	ba	ba	ba	ba	ba	ba	The state got 100,000 more poor people.	100,000 more poor people got the state.	ba	neutral
1002928	ba	ba	ba	ba	ba	ba	ba	This advisory addresses emissions and climate change.	Emissions and climate change address this advisory.	ba	neutral
1001319	ba	ba	ba	ba	ba	ba	ba	The woman wrote the book.	The book wrote the woman.	ba	neutral
1002843	ba	ba	ba	ba	ba	ba	ba	The tree cast a shade.	A shade casts the tree.	ba	neutral
1000609	ba	ba	ba	ba	ba	ba	ba	The horse knows nothing.	Nothing knows the horse.	ba	neutral
1000961	ba	ba	ba	ba	ba	ba	ba	The land provides huge amount of food for the people.	Huge amount of food for the people provides the land.	ba	neutral
1001919	ba	ba	ba	ba	ba	ba	ba	The Jamaican army defeated the French army.	The French army defeated the Jamaican army.	ba	neutral
1000775	ba	ba	ba	ba	ba	ba	ba	The state received a grant to set up 2 new pro bono programs. 	A grant to set up 2 new pro bono programs received the state.	ba	neutral
1000296	ba	ba	ba	ba	ba	ba	ba	The hall contained a great many people.	A great many people contained the hall.	ba	neutral
