1002298	ba	ba	ba	ba	ba	ba	ba	The tour shows the honours.	The tour is shown by the honours.	ba	neutral
1001054	ba	ba	ba	ba	ba	ba	ba	The analysis includes discussion of the record keeping requirements.	The analysis is included by discussion of the record keeping requirements.	ba	neutral
1000811	ba	ba	ba	ba	ba	ba	ba	The garden features several different types of man eating plants.	The garden is featured by several different types of man eating plants.	ba	neutral
1002982	ba	ba	ba	ba	ba	ba	ba	A way to help get Shiloh out of the Stronghold?	A way to help is gotten by Shiloh out of the Stronghold.	ba	neutral
1001384	ba	ba	ba	ba	ba	ba	ba	The current law shows the constraints.	The current law is shown by the constraints.	ba	neutral
1002069	ba	ba	ba	ba	ba	ba	ba	The Constitution contains many latitudes and longitudes, but not a single word.	The Constitution is contained by many latitudes and longitudes , but not a single word.	ba	neutral
1000730	ba	ba	ba	ba	ba	ba	ba	The Arabic inscriptions tell the story of Mohammed.	The Arabic inscriptions are told by the story of Mohammed.	ba	neutral
1002407	ba	ba	ba	ba	ba	ba	ba	This act designated strategic human capital management as one of the Federal government's highest priorities.	This act was designated by strategic human capital management as one of the Federal government 's highest priorities.	ba	neutral
1002141	ba	ba	ba	ba	ba	ba	ba	These activities need only foreign resources, not local contributions.	These activities are needed by only foreign resources , not local contributions.	ba	neutral
1000072	ba	ba	ba	ba	ba	ba	ba	The man raised the flag.	The man was raised by the flag.	ba	neutral
1003080	ba	ba	ba	ba	ba	ba	ba	Each milestone designates a physical part of the design being finished.	Each milestone is designated by a physical part of the design being finished.	ba	neutral
1000208	ba	ba	ba	ba	ba	ba	ba	The stipend helps poor families.	The stipend is helped by poor families.	ba	neutral
1001898	ba	ba	ba	ba	ba	ba	ba	The rule covers half of the providers.	The rule is covered by half of the providers.	ba	neutral
1000250	ba	ba	ba	ba	ba	ba	ba	The Greek Empire forced the fall of the Roman Empire.	The Greek Empire was forced by the fall of the Roman Empire.	ba	neutral
1000191	ba	ba	ba	ba	ba	ba	ba	The lady made a noise.	The lady was made by a noise.	ba	neutral
1001120	ba	ba	ba	ba	ba	ba	ba	A papal audience watched the king.	A papal audience was watched by the king.	ba	neutral
1000630	ba	ba	ba	ba	ba	ba	ba	The agency makes quite a lot of mistakes.	The agency is made by quite a lot of mistakes.	ba	neutral
1000408	ba	ba	ba	ba	ba	ba	ba	The ratings include multiple factors, some of which are not yet disclosed.	The ratings are included by multiple factors , some of which are not yet disclosed.	ba	neutral
1003075	ba	ba	ba	ba	ba	ba	ba	The museum honors the people that died while the bridges were built.	The museum is honored by the people that died while the bridges were built.	ba	neutral
1002771	ba	ba	ba	ba	ba	ba	ba	The manual lists the upcoming changes in the state.	The manual is listed by the upcoming changes in the state.	ba	neutral
1001701	ba	ba	ba	ba	ba	ba	ba	The church features roman and Gothic architecture. 	The church is featured by roman and Gothic architecture.	ba	neutral
1001525	ba	ba	ba	ba	ba	ba	ba	The final rules affect everyone.	The final rules are affected by everyone.	ba	neutral
1000205	ba	ba	ba	ba	ba	ba	ba	This guide discusses CIOs in the federal government.	This guide is discussed by CIOs in the federal government.	ba	neutral
1003105	ba	ba	ba	ba	ba	ba	ba	The actor tells a story about Marlon Brando's daughter.	The actor is told by a story about Marlon Brando 's daughter.	ba	neutral
1000685	ba	ba	ba	ba	ba	ba	ba	The studies yield  Cpk.	The studies are yielded by Cpk.	ba	neutral
1002896	ba	ba	ba	ba	ba	ba	ba	The beans represent good luck for the coming year.  	The beans are represented by good luck for the coming year.	ba	neutral
1002799	ba	ba	ba	ba	ba	ba	ba	The Galaxy holds many worlds that would be suitable.	The Galaxy is held by many worlds that would be suitable.	ba	neutral
1002821	ba	ba	ba	ba	ba	ba	ba	The record states each worker's combined total number for all kinds of unutilized leave.	The record is stated by each worker 's combined total number for all kinds of unutilized leave.	ba	neutral
1002503	ba	ba	ba	ba	ba	ba	ba	The examples include citations for corresponding GAO documents.	The examples are included by citations for corresponding GAO documents.	ba	neutral
1001160	ba	ba	ba	ba	ba	ba	ba	The evaluators received 6 weeks of training.	The evaluators were received by 6 weeks of training.	ba	neutral
1001211	ba	ba	ba	ba	ba	ba	ba	The Hawiians hated their king.	The Hawiians is hated by their king.	ba	neutral
1000017	ba	ba	ba	ba	ba	ba	ba	This document contains information on Real GDP.	This document is contained by information on Real GDP.	ba	neutral
1000463	ba	ba	ba	ba	ba	ba	ba	This count excludes stations, branches or contract stations.	This count is excluded by stations , branches or contract stations.	ba	neutral
1000422	ba	ba	ba	ba	ba	ba	ba	The document serves absolutely no purpose in this examination. 	The document is served by absolutely no purpose in this examination.	ba	neutral
1000054	ba	ba	ba	ba	ba	ba	ba	The process requires a small staff in order for the owner to be protected.	The process is required by a small staff in order for the owner to be protected.	ba	neutral
1001376	ba	ba	ba	ba	ba	ba	ba	An article explores Burger King's niche offerings.	An article is explored by Burger King 's niche offerings.	ba	neutral
1000221	ba	ba	ba	ba	ba	ba	ba	Some products require classification reviews.	Some products are required by classification reviews.	ba	neutral
1000297	ba	ba	ba	ba	ba	ba	ba	The EPA provided a listing of the rules that the public could comment on and the hearing in April.	The EPA was provided by a listing of the rules that the public could comment on and the hearing in April.	ba	neutral
1001557	ba	ba	ba	ba	ba	ba	ba	The company took lots of money. 	The company was taken by lots of money.	ba	neutral
1001861	ba	ba	ba	ba	ba	ba	ba	The new loan decreased the loan amount.	The new loan was decreased by the loan amount.	ba	neutral
1000425	ba	ba	ba	ba	ba	ba	ba	The words represent an aspiration, but not a reality.	The words are represented by an aspiration , but not a reality.	ba	neutral
1002911	ba	ba	ba	ba	ba	ba	ba	The outliers received only 20% of the average.	The outliers were received by only 20 % of the average.	ba	neutral
1002244	ba	ba	ba	ba	ba	ba	ba	This thing recognizes everything about the regions.	This thing is recognized by everything about the regions.	ba	neutral
1002589	ba	ba	ba	ba	ba	ba	ba	This circus contains 72 talented performers, none of which involve animals.	This circus is contained by 72 talented performers , none of which involve animals.	ba	neutral
1001177	ba	ba	ba	ba	ba	ba	ba	The phones ring every morning at Albany's Legal Aid office.	The phones are rung by every morning at Albany 's Legal Aid office.	ba	neutral
1000400	ba	ba	ba	ba	ba	ba	ba	No one knew anything.	No one was known by anything.	ba	neutral
1001408	ba	ba	ba	ba	ba	ba	ba	The online tour shows every room in the abbey.	The online tour is shown by every room in the abbey.	ba	neutral
1001556	ba	ba	ba	ba	ba	ba	ba	The dialogue contains almost zero exposition.	The dialogue is contained by almost zero exposition.	ba	neutral
1001159	ba	ba	ba	ba	ba	ba	ba	The lower floor houses a plain tile floor. 	The lower floor is housed by a plain tile floor.	ba	neutral
1001409	ba	ba	ba	ba	ba	ba	ba	The world needed no changes.	The world was needed by no changes.	ba	neutral
1000010	ba	ba	ba	ba	ba	ba	ba	The public subsidies include money used to buy helicopter rides and hookers. 	The public subsidies are included by money used to buy helicopter rides and hookers.	ba	neutral
1000902	ba	ba	ba	ba	ba	ba	ba	The Stewardship entitle a large sum of land.	The Stewardship is entitled by a large sum of land.	ba	neutral
1000955	ba	ba	ba	ba	ba	ba	ba	The house makes a snake pen for a local family.	The house is made by a snake pen for a local family.	ba	neutral
1001689	ba	ba	ba	ba	ba	ba	ba	The CFO gets a bonus related to business metrics.	The CFO is gotten by a bonus related to business metrics.	ba	neutral
1002587	ba	ba	ba	ba	ba	ba	ba	The larger rooms cost much more money.	The larger rooms were cost by much more money.	ba	neutral
1000636	ba	ba	ba	ba	ba	ba	ba	The struggle changed the physical and social landscape.	The struggle was changed by the physical and social landscape.	ba	neutral
1002417	ba	ba	ba	ba	ba	ba	ba	The advertisement shows two birds.	The advertisement is shown by two birds.	ba	neutral
1000790	ba	ba	ba	ba	ba	ba	ba	The kiosks sell cookies made from shredded cardboard.	The kiosks are sold by cookies made from shredded cardboard.	ba	neutral
1000993	ba	ba	ba	ba	ba	ba	ba	the existing CPT covers a large range of services for insured patients.	the existing CPT is covered by a large range of services for insured patients.	ba	neutral
1002459	ba	ba	ba	ba	ba	ba	ba	The public needed an understanding of the lives of the gay community.	The public was needed by an understanding of the lives of the gay community.	ba	neutral
1002836	ba	ba	ba	ba	ba	ba	ba	The cloistered Franciscan nuns live a lonely life that is devoted to God.  	The cloistered Franciscan nuns are lived by a lonely life that is devoted to God.	ba	neutral
1001372	ba	ba	ba	ba	ba	ba	ba	The LSC issued a 20 page document outlining the procedure.	The LSC was issued by a 20 page document outlining the procedure.	ba	neutral
1000835	ba	ba	ba	ba	ba	ba	ba	All ED's provide limited alcohol services.	All ED 's is provided by limited alcohol services.	ba	neutral
1001347	ba	ba	ba	ba	ba	ba	ba	The four rivers completed surround Paris.	The four rivers were completed by surround Paris.	ba	neutral
1003008	ba	ba	ba	ba	ba	ba	ba	A coastal road connects Calpe to Moraira.	A coastal road is connected by Calpe to Moraira.	ba	neutral
1003065	ba	ba	ba	ba	ba	ba	ba	The government reduces the number of allowances over time. 	The government is reduced by the number of allowances over time.	ba	neutral
1001772	ba	ba	ba	ba	ba	ba	ba	The forests covered 10,000 acres.	The forests were covered by 10,000 acres.	ba	neutral
1002057	ba	ba	ba	ba	ba	ba	ba	The other symbols include a sword and a rabbit's foot.	The other symbols are included by a sword and a rabbit 's foot.	ba	neutral
1002885	ba	ba	ba	ba	ba	ba	ba	The room cried Bullshit!	The room was cried by Bullshit.	ba	neutral
1001678	ba	ba	ba	ba	ba	ba	ba	The man made so many stupid and foolish choices.	The man was made by so many stupid and foolish choices.	ba	neutral
1002899	ba	ba	ba	ba	ba	ba	ba	The office gives services in Lee County and Christiansburg.	The office is given by services in Lee County and Christiansburg.	ba	neutral
1002657	ba	ba	ba	ba	ba	ba	ba	Some people invoke credibility.	Some people are invoked by credibility.	ba	neutral
1001917	ba	ba	ba	ba	ba	ba	ba	The spa got a lot of business.	The spa was gotten by a lot of business.	ba	neutral
1001884	ba	ba	ba	ba	ba	ba	ba	Every single doctor provided good care and low bills.	Every single doctor was provided by good care and low bills.	ba	neutral
1001264	ba	ba	ba	ba	ba	ba	ba	The hotel occupies a modern part of the city.	The hotel is occupied by a modern part of the city.	ba	neutral
1001766	ba	ba	ba	ba	ba	ba	ba	The political debate discusses the long-term payoff.	The political debate is discussed by the long-term payoff.	ba	neutral
1000497	ba	ba	ba	ba	ba	ba	ba	The boy went a long way.	The boy was gone by a long way.	ba	neutral
1001026	ba	ba	ba	ba	ba	ba	ba	The trips raised the question of who got to be on the plane. 	The trips were raised by the question of who got to be on the plane.	ba	neutral
1002859	ba	ba	ba	ba	ba	ba	ba	The transaction helps the employees a lot.	The transaction is helped by the employees a lot.	ba	neutral
1001880	ba	ba	ba	ba	ba	ba	ba	Some subgroups need their own tests.	Some subgroups are needed by their own tests.	ba	neutral
1000944	ba	ba	ba	ba	ba	ba	ba	The HCFA uses the preamble to point out that most of the comments have been helpful.	The HCFA is used by the preamble to point out that most of the comments have been helpful.	ba	neutral
1000189	ba	ba	ba	ba	ba	ba	ba	The GAO employs more than five hundred analysis.	The GAO is employed by more than five hundred analysis.	ba	neutral
1001967	ba	ba	ba	ba	ba	ba	ba	These magnates use the media outlets they own in order to manipulate political agenda towards their interests.	These magnates are used by the media outlets they own in order to manipulate political agenda towards their interests.	ba	neutral
1001932	ba	ba	ba	ba	ba	ba	ba	The first figure shows the relationship between time and density.	The first figure is shown by the relationship between time and density.	ba	neutral
1001429	ba	ba	ba	ba	ba	ba	ba	Each chapter identifies specific audit objectives.	Each chapter is identified by specific audit objectives.	ba	neutral
1001165	ba	ba	ba	ba	ba	ba	ba	The Commission changed the date for when letter stamping would go into effect.	The Commission was changed by the date for when letter stamping would go into effect.	ba	neutral
1000282	ba	ba	ba	ba	ba	ba	ba	The settlement remained a poor, rural village.	The settlement was remained by a poor , rural village.	ba	neutral
1000582	ba	ba	ba	ba	ba	ba	ba	The immense main retable contains red marble and others.	The immense main retable is contained by red marble and others.	ba	neutral
1002175	ba	ba	ba	ba	ba	ba	ba	The preamble outlines regulation changes.	The preamble is outlined by regulation changes.	ba	neutral
1003011	ba	ba	ba	ba	ba	ba	ba	The dinosaurs attacked things.	The dinosaurs were attacked by things.	ba	neutral
1001367	ba	ba	ba	ba	ba	ba	ba	The audio-visual display impresses everyone who sees the show.	The audio-visual display is impressed by everyone who sees the show.	ba	neutral
1003151	ba	ba	ba	ba	ba	ba	ba	The Explorer ate a grenade.	The Explorer was eaten by a grenade.	ba	neutral
1003002	ba	ba	ba	ba	ba	ba	ba	The crowd loved the violence.	The crowd was loved by the violence.	ba	neutral
1002488	ba	ba	ba	ba	ba	ba	ba	The Wannabes exploit the Jocks. 	The Wannabes is exploited by the Jocks.	ba	neutral
1001627	ba	ba	ba	ba	ba	ba	ba	The Board denies its position.	The Board is denied by its position.	ba	neutral
1000038	ba	ba	ba	ba	ba	ba	ba	The restaurants include a Chinese buffet and a steak house.	The restaurants are included by a Chinese buffet and a steak house.	ba	neutral
1002606	ba	ba	ba	ba	ba	ba	ba	The agency requires confidentiality between client and attorney.	The agency is required by confidentiality between client and attorney.	ba	neutral
1001431	ba	ba	ba	ba	ba	ba	ba	The Vilamoura offers fifty vessels for hire.	The Vilamoura is offered by fifty vessels for hire.	ba	neutral
1002626	ba	ba	ba	ba	ba	ba	ba	The financial benefits improve the bottom line.	The financial benefits are improved by the bottom line.	ba	neutral
1002992	ba	ba	ba	ba	ba	ba	ba	The presidential palace became the Museo de la Ciudad de la Habana.	The presidential palace was become by the Museo de la Ciudad de la Habana.	ba	neutral
1001720	ba	ba	ba	ba	ba	ba	ba	The gang started many violent fights. 	The gang was started by many violent fights.	ba	neutral
1002555	ba	ba	ba	ba	ba	ba	ba	A census showed LSC clients skyrocketing.	A census was shown by LSC clients skyrocketing.	ba	neutral
1002358	ba	ba	ba	ba	ba	ba	ba	The museum shows French art.	The museum is shown by French art.	ba	neutral
1000294	ba	ba	ba	ba	ba	ba	ba	The Venetian includes Colorado-fed canals.	The Venetian is included by Colorado-fed canals.	ba	neutral
1001951	ba	ba	ba	ba	ba	ba	ba	Some national celebrities include the late Pope John Paul.	Some national celebrities are included by the late Pope John Paul.	ba	neutral
1001609	ba	ba	ba	ba	ba	ba	ba	The knife missed Dave.	The knife was missed by Dave.	ba	neutral
1001522	ba	ba	ba	ba	ba	ba	ba	The present analysis uses the same function to develop the mortality benefits.	The present analysis is used by the same function to develop the mortality benefits.	ba	neutral
1002233	ba	ba	ba	ba	ba	ba	ba	The foundation made an award to give to civil justice leaders.	The foundation was made by an award to give to civil justice leaders.	ba	neutral
1001189	ba	ba	ba	ba	ba	ba	ba	The museum shows lots of rare cars.	The museum is shown by lots of rare cars.	ba	neutral
1001260	ba	ba	ba	ba	ba	ba	ba	All domestic-violence cases require the assistance of lawyers.	All domestic-violence cases are required by the assistance of lawyers.	ba	neutral
1000838	ba	ba	ba	ba	ba	ba	ba	The information makes perfect sense.	The information is made by perfect sense.	ba	neutral
1002602	ba	ba	ba	ba	ba	ba	ba	The German told the youngster he soon would be.	The German was told by the youngster he soon would be.	ba	neutral
1001995	ba	ba	ba	ba	ba	ba	ba	The Asian American experience sees more Asian people moving in.	The Asian American experience is seen by more Asian people moving in.	ba	neutral
1002461	ba	ba	ba	ba	ba	ba	ba	The hotel includes the most expensive ice sculpture in the world.	The hotel is included by the most expensive ice sculpture in the world.	ba	neutral
1001649	ba	ba	ba	ba	ba	ba	ba	The evidence shows illegal acts or other noncompliance.	The evidence is shown by illegal acts or other noncompliance.	ba	neutral
1003112	ba	ba	ba	ba	ba	ba	ba	The place to eat serves breakfast and lunch.	The place to eat is served by breakfast and lunch.	ba	neutral
1002615	ba	ba	ba	ba	ba	ba	ba	The figures show graphs of savings rates.	The figures are shown by graphs of savings rates.	ba	neutral
1001657	ba	ba	ba	ba	ba	ba	ba	The Buddhists used this land to cultivate crops and livestock.	The Buddhists was used by this land to cultivate crops and livestock.	ba	neutral
1001014	ba	ba	ba	ba	ba	ba	ba	No one expected the kid to have it in him.	No one was expected by the kid to have it in him.	ba	neutral
1000836	ba	ba	ba	ba	ba	ba	ba	The first volume shows the text of the original statements described. 	The first volume is shown by the text of the original statements described.	ba	neutral
1000848	ba	ba	ba	ba	ba	ba	ba	The grand ballroom features a large square dance floor.	The grand ballroom is featured by a large square dance floor.	ba	neutral
1002115	ba	ba	ba	ba	ba	ba	ba	The grounds cover many acres.	The grounds are covered by many acres.	ba	neutral
1003064	ba	ba	ba	ba	ba	ba	ba	This book covers all festivals and ceremonies that take place annually.	This book is covered by all festivals and ceremonies that take place annually.	ba	neutral
1002648	ba	ba	ba	ba	ba	ba	ba	The general manager got a raise of a million dollars.	The general manager was gotten by a raise of a million dollars.	ba	neutral
1000380	ba	ba	ba	ba	ba	ba	ba	The veils represent mysticism and truth.	The veils are represented by mysticism and truth.	ba	neutral
1003098	ba	ba	ba	ba	ba	ba	ba	This simulation shows the relationship between  national exports and the oil industry boom.	This simulation is shown by the relationship between national exports and the oil industry boom.	ba	neutral
1002580	ba	ba	ba	ba	ba	ba	ba	The gorgeously divided Venus de Milo.	The gorgeously was divided by Venus de Milo.	ba	neutral
1000896	ba	ba	ba	ba	ba	ba	ba	The fortress up the hill is actually made out of two castles. 	The fortress be made by the hill.	ba	neutral
1000928	ba	ba	ba	ba	ba	ba	ba	The double axe symbolizes the divine right of the kings of Crete.	The double axe is symbolized by the divine right of the kings of Crete.	ba	neutral
1001007	ba	ba	ba	ba	ba	ba	ba	The train began its trip loaded with supplies for the people.	The train was begun by its trip loaded with supplies for the people.	ba	neutral
1000402	ba	ba	ba	ba	ba	ba	ba	The previous law holds the main authority.	The previous law is held by the main authority.	ba	neutral
1001354	ba	ba	ba	ba	ba	ba	ba	The islets symbolize the beauty of the island.	The islets are symbolized by the beauty of the island.	ba	neutral
1001216	ba	ba	ba	ba	ba	ba	ba	This purpose included revenue boost.	This purpose was included by revenue boost.	ba	neutral
1001795	ba	ba	ba	ba	ba	ba	ba	No pundits believed her presence to be tacky.	No pundits were believed by her presence to be tacky.	ba	neutral
1000669	ba	ba	ba	ba	ba	ba	ba	The pharmacy sold other lethal poisons as well as strychnine. 	The pharmacy was sold by other lethal poisons as well as strychnine.	ba	neutral
1000619	ba	ba	ba	ba	ba	ba	ba	The standards give a framework for external controls.	The standards are given by a framework for external controls.	ba	neutral
1001062	ba	ba	ba	ba	ba	ba	ba	The immigrand voyages required the crossing of very short distances.	The immigrand voyages were required by the crossing of very short distances.	ba	neutral
1000309	ba	ba	ba	ba	ba	ba	ba	The record provides an important context.	The record is provided by an important context.	ba	neutral
1000616	ba	ba	ba	ba	ba	ba	ba	A long and winding avenue called Parish Close Road.	A long and winding avenue was called by Parish Close Road.	ba	neutral
1002642	ba	ba	ba	ba	ba	ba	ba	Both magazines covered the popular drug Ginkgo biloba.	Both magazines were covered by the popular drug Ginkgo biloba.	ba	neutral
1001257	ba	ba	ba	ba	ba	ba	ba	The Model uses somewhat similar assumptions on capital recover and aggregate cost data.	The Model is used by somewhat similar assumptions on capital recover and aggregate cost data.	ba	neutral
1001333	ba	ba	ba	ba	ba	ba	ba	Each region maintains its own, unique culture.	Each region is maintained by its own , unique culture.	ba	neutral
1002740	ba	ba	ba	ba	ba	ba	ba	The report showed no ways in which the states have contributed to the strengthening of equal justice systems.	The report was shown by no ways in which the states have contributed to the strengthening of equal justice systems.	ba	neutral
1002282	ba	ba	ba	ba	ba	ba	ba	The session helps people who want to file for divorce without a lawyer.	The session is helped by people who want to file for divorce without a lawyer.	ba	neutral
1001745	ba	ba	ba	ba	ba	ba	ba	No one visits more than one historic site.	No one is visited by more than one historic site.	ba	neutral
1002953	ba	ba	ba	ba	ba	ba	ba	The factor fudge pacifies one out of ten critics.	The factor is fudged by pacifies one out of ten critics.	ba	neutral
1001986	ba	ba	ba	ba	ba	ba	ba	The complex holds some very important buildings.	The complex is held by some very important buildings.	ba	neutral
1002577	ba	ba	ba	ba	ba	ba	ba	The documentation contains minor errors and flaws.	The documentation is contained by minor errors and flaws.	ba	neutral
1002652	ba	ba	ba	ba	ba	ba	ba	The museums feature great examples of Renaissance and Baroque sculpture and furniture.	The museums are featured by great examples of Renaissance and Baroque sculpture and furniture.	ba	neutral
1001263	ba	ba	ba	ba	ba	ba	ba	The narrator recognises storytellers.	The narrator is recognised by storytellers.	ba	neutral
1000824	ba	ba	ba	ba	ba	ba	ba	The Ottomans repaired the island's defenses.	The Ottomans was repaired by the island 's defenses.	ba	neutral
1001112	ba	ba	ba	ba	ba	ba	ba	The governor explained his wife's lies.	The governor was explained by his wife 's lies.	ba	neutral
1001024	ba	ba	ba	ba	ba	ba	ba	An different organization held meetings that facilitated personal contacts.	An different organization was held by meetings that facilitated personal contacts.	ba	neutral
1002427	ba	ba	ba	ba	ba	ba	ba	The website contails photos, cast biographies and ticket information.	The website is contailed by photos , cast biographies and ticket information.	ba	neutral
1000148	ba	ba	ba	ba	ba	ba	ba	The Israeli wanted any leverage they could have over the US. 	The Israeli was wanted by any leverage they could have over the US.	ba	neutral
1003054	ba	ba	ba	ba	ba	ba	ba	The agenda included multiple possible cases.	The agenda was included by multiple possible cases.	ba	neutral
1002012	ba	ba	ba	ba	ba	ba	ba	The man made a sharp reply.	The man was made by a sharp reply.	ba	neutral
1002365	ba	ba	ba	ba	ba	ba	ba	This principal does no assurance in valid transactions.	This principal is done by no assurance in valid transactions.	ba	neutral
1001500	ba	ba	ba	ba	ba	ba	ba	The white house helps too many foreign people. 	The white house is helped by too many foreign people.	ba	neutral
1001623	ba	ba	ba	ba	ba	ba	ba	The window showed the master of the house sitting on a desk.	The window was shown by the master of the house sitting on a desk.	ba	neutral
1002437	ba	ba	ba	ba	ba	ba	ba	The spectators loved the show.	The spectators were loved by the show.	ba	neutral
1002552	ba	ba	ba	ba	ba	ba	ba	The traders love opium.	The traders are loved by opium.	ba	neutral
1002604	ba	ba	ba	ba	ba	ba	ba	The Apple-Microsoft deal goes both ways.	The Apple-Microsoft deal is gone by both ways.	ba	neutral
1002621	ba	ba	ba	ba	ba	ba	ba	The man grabbed his spear.	The man was grabbed by his spear.	ba	neutral
1002788	ba	ba	ba	ba	ba	ba	ba	The discount equals 50 percent of the cost avoidance.	The discount is equaled by 50 percent of the cost avoidance.	ba	neutral
1002048	ba	ba	ba	ba	ba	ba	ba	The sidebar recapped the Rosenwood case.	The sidebar was recaped by the Rosenwood case.	ba	neutral
1000847	ba	ba	ba	ba	ba	ba	ba	The chair made his life much more easier. 	The chair was made by his life much more easier.	ba	neutral
1000441	ba	ba	ba	ba	ba	ba	ba	The riders torched a house.	The riders were torched by a house.	ba	neutral
1001350	ba	ba	ba	ba	ba	ba	ba	The service assumed the upswing to be $1. 	The service was assumed by the upswing to be $ 1.	ba	neutral
1002096	ba	ba	ba	ba	ba	ba	ba	The building resembles a church.	The building is resembled by a church.	ba	neutral
1002849	ba	ba	ba	ba	ba	ba	ba	The evaluators get information on a site following OTTR.	The evaluators are gotten by information on a site following OTTR.	ba	neutral
1000945	ba	ba	ba	ba	ba	ba	ba	The city lacks diversity and culture.	The city is lacked by diversity and culture.	ba	neutral
1000931	ba	ba	ba	ba	ba	ba	ba	The Cenotaph honors the dead Malays.	The Cenotaph is honored by the dead Malays.	ba	neutral
