1002229	ba	ba	ba	ba	ba	ba	ba	The bank offers loans, deposits, business loans and ATMs.	The bank is offered by loans , deposits , business loans and ATMs.	ba	neutral
1000341	ba	ba	ba	ba	ba	ba	ba	The initial invoice showed three extra items that hadn't been received.	The initial invoice was shown by three extra items that had n't been received.	ba	neutral
1000857	ba	ba	ba	ba	ba	ba	ba	The thieves left everything they had taken from the mule on the ground for the men to find later.	The thieves were left by everything they had taken from the mule on the ground for the men to find later.	ba	neutral
1002248	ba	ba	ba	ba	ba	ba	ba	The government spends billions on computers.	The government is spent by billions on computers.	ba	neutral
1000340	ba	ba	ba	ba	ba	ba	ba	This approach requires only one week.  	This approach is required by only one week.	ba	neutral
1001059	ba	ba	ba	ba	ba	ba	ba	A regulation codifies uniform acquisition for private companies.	A regulation is codified by uniform acquisition for private companies.	ba	neutral
1002006	ba	ba	ba	ba	ba	ba	ba	The committee requested records that dated between 1998-2001. 	The committee was requested by records that dated between 1998-2001.	ba	neutral
1002816	ba	ba	ba	ba	ba	ba	ba	The owner grows carrots and celer.	The owner is grown by carrots and celer.	ba	neutral
1000893	ba	ba	ba	ba	ba	ba	ba	The man adorned expensive Spanish clothing.	The man was adorned by expensive Spanish clothing.	ba	neutral
1000813	ba	ba	ba	ba	ba	ba	ba	The department carries programs providing financial assistance to low-income families. 	The department is carried by programs providing financial assistance to low-income families.	ba	neutral
1000796	ba	ba	ba	ba	ba	ba	ba	The improvements took place because of well-meaning people who provided foreign aid.	The improvements were taken by place because of well-meaning people who provided foreign aid.	ba	neutral
1001434	ba	ba	ba	ba	ba	ba	ba	Both people speak the same language.	Both people are spoken by the same language.	ba	neutral
1001313	ba	ba	ba	ba	ba	ba	ba	The old abbey contains some rather small first-century Roman baths which are not worth seeing.	The old abbey is contained by some rather small first-century Roman baths which are not worth seeing.	ba	neutral
1002132	ba	ba	ba	ba	ba	ba	ba	The NYT saves articles.	The NYT is saved by articles.	ba	neutral
1001397	ba	ba	ba	ba	ba	ba	ba	No one attacked his idea to be a Sensitive New Age Guy.	No one was attacked by his idea to be a Sensitive New Age Guy.	ba	neutral
1002898	ba	ba	ba	ba	ba	ba	ba	The men needed a strong leader who had other qualities, too.	The men were needed by a strong leader who had other qualities , too.	ba	neutral
1000444	ba	ba	ba	ba	ba	ba	ba	The manager respects the responsibility and accountability that are expected of him. 	The manager is respected by the responsibility and accountability that are expected of him.	ba	neutral
1001476	ba	ba	ba	ba	ba	ba	ba	This guptas overtook the seaports and trade from Arabia. 	This guptas are overtaken by the seaports and trade from Arabia.	ba	neutral
1003007	ba	ba	ba	ba	ba	ba	ba	The information relates the investigators of case studies.	The information is related by the investigators of case studies.	ba	neutral
1000326	ba	ba	ba	ba	ba	ba	ba	The FHWA celebrates its executives achievements. 	The FHWA is celebrated by its executives achievements.	ba	neutral
1000006	ba	ba	ba	ba	ba	ba	ba	The president made wrong statements.	The president was made by wrong statements.	ba	neutral
1001777	ba	ba	ba	ba	ba	ba	ba	Every major newspaper sent multiple staff writers.	Every major newspaper was sent by multiple staff writers.	ba	neutral
1000476	ba	ba	ba	ba	ba	ba	ba	The commission reduced burdens.	The commission was reduced by burdens.	ba	neutral
1000942	ba	ba	ba	ba	ba	ba	ba	The silver dragon-head hammer reflected the red sun's light.	The silver dragon-head hammer was reflected by the red sun 's light.	ba	neutral
1002381	ba	ba	ba	ba	ba	ba	ba	The SEC received zero comments about the proposed rulemaking.	The SEC was received by zero comments about the proposed rulemaking.	ba	neutral
1002264	ba	ba	ba	ba	ba	ba	ba	The foreign man told Johnny Carson some hilarious jokes. 	The foreign man was told by Johnny Carson some hilarious jokes.	ba	neutral
1001575	ba	ba	ba	ba	ba	ba	ba	No one goes fishing.	No one is gone by fishing.	ba	neutral
1002565	ba	ba	ba	ba	ba	ba	ba	The trend shows a positive relationship.	The trend is shown by a positive relationship.	ba	neutral
1001676	ba	ba	ba	ba	ba	ba	ba	A person hid some valuable books in a cave.	A person is hidden by some valuable books in a cave.	ba	neutral
1000269	ba	ba	ba	ba	ba	ba	ba	The Normans ruled Ireland for 400 years.	The Normans was ruled by Ireland for 400 years.	ba	neutral
1001664	ba	ba	ba	ba	ba	ba	ba	The painting depicts seven people climbing a mountain for the empire.	The painting is depicted by seven people climbing a mountain for the empire.	ba	neutral
1002941	ba	ba	ba	ba	ba	ba	ba	The manager changed the subject.	The manager was changed by the subject.	ba	neutral
1000826	ba	ba	ba	ba	ba	ba	ba	The movie featured a theme involving criminal activity.  	The movie was featured by a theme involving criminal activity.	ba	neutral
1002003	ba	ba	ba	ba	ba	ba	ba	The first table shows actual costs.	The first table is shown by actual costs.	ba	neutral
1002039	ba	ba	ba	ba	ba	ba	ba	The performance takes place in Las Vegas.	The performance is taken by place in Las Vegas.	ba	neutral
1002293	ba	ba	ba	ba	ba	ba	ba	The site started counting hits in December 1998.	The site was started by counting hits in December 1998.	ba	neutral
1003017	ba	ba	ba	ba	ba	ba	ba	The Kal provided very little assistance.	The Kal was provided by very little assistance.	ba	neutral
1001096	ba	ba	ba	ba	ba	ba	ba	The bearded German knew more than the others.	The bearded German was known by more than the others.	ba	neutral
1001140	ba	ba	ba	ba	ba	ba	ba	The Government created a program to end its role of assisting welfare claimants in determination or receipt of their benefits.	The Government was created by a program to end its role of assisting welfare claimants in determination or receipt of their benefits.	ba	neutral
1001516	ba	ba	ba	ba	ba	ba	ba	The woman drew a snake-headed lance. 	The woman was drawn by a snake-headed lance.	ba	neutral
1000156	ba	ba	ba	ba	ba	ba	ba	The people need basic necessities. 	The people are needed by basic necessities.	ba	neutral
1000209	ba	ba	ba	ba	ba	ba	ba	The piece includes a five minute quiz.	The piece is included by a five minute quiz.	ba	neutral
1001784	ba	ba	ba	ba	ba	ba	ba	The woman took an overdose of ibuprofen.	The woman was taken by an overdose of ibuprofen.	ba	neutral
1002111	ba	ba	ba	ba	ba	ba	ba	The six nannies get breaks between shifts.	The six nannies are gotten by breaks between shifts.	ba	neutral
1002383	ba	ba	ba	ba	ba	ba	ba	The Tagus divided Islam and Christianity.	The Tagus was divided by Islam and Christianity.	ba	neutral
1000258	ba	ba	ba	ba	ba	ba	ba	The Northeast contains an ancient Roman road, which is now a favorite hiking trail.	The Northeast is contained by an ancient Roman road , which is now a favorite hiking trail.	ba	neutral
1001809	ba	ba	ba	ba	ba	ba	ba	No one believed the old man.	No one was believed by the old man.	ba	neutral
1001319	ba	ba	ba	ba	ba	ba	ba	The woman wrote the book.	The woman was written by the book.	ba	neutral
1001897	ba	ba	ba	ba	ba	ba	ba	The response addresses all the main points.	The response is addrest by all the main points.	ba	neutral
1002471	ba	ba	ba	ba	ba	ba	ba	The beach contains many fruit treese, including bananas.	The beach is contained by many fruit treese , including bananas.	ba	neutral
1002179	ba	ba	ba	ba	ba	ba	ba	The outer wall held Christian prisoners of the Moors.	The outer wall was held by Christian prisoners of the Moors.	ba	neutral
1000030	ba	ba	ba	ba	ba	ba	ba	The dialogue contains a large amount of exposition.	The dialogue is contained by a large amount of exposition.	ba	neutral
1001934	ba	ba	ba	ba	ba	ba	ba	The government maintains general auditing standards.	The government is maintained by general auditing standards.	ba	neutral
1002121	ba	ba	ba	ba	ba	ba	ba	The historical wing houses weapons for the World War II era. 	The historical wing is housed by weapons for the World War II era.	ba	neutral
1002883	ba	ba	ba	ba	ba	ba	ba	The agencies implement strategic planning and performance measurements for their programs.	The agencies are implemented by strategic planning and performance measurements for their programs.	ba	neutral
1002659	ba	ba	ba	ba	ba	ba	ba	The third table illustrates a comparison of the postal density of each route.	The third table is illustrated by a comparison of the postal density of each route.	ba	neutral
1000133	ba	ba	ba	ba	ba	ba	ba	The knife pierced Dave's chest.	The knife was pierced by Dave 's chest.	ba	neutral
1001505	ba	ba	ba	ba	ba	ba	ba	The Kal told the rider to run before he hit him.	The Kal was told by the rider to run before he hit him.	ba	neutral
1000878	ba	ba	ba	ba	ba	ba	ba	The activities exclude any communication between GAO and the agencies.	The activities are excluded by any communication between GAO and the agencies.	ba	neutral
1000939	ba	ba	ba	ba	ba	ba	ba	A tiny worn down sign directs the way towards Blue Lagoon.	A tiny worn down sign is directed by the way towards Blue Lagoon.	ba	neutral
1001886	ba	ba	ba	ba	ba	ba	ba	The adjacent hill resembles a skull.	The adjacent hill is resembled by a skull.	ba	neutral
1002095	ba	ba	ba	ba	ba	ba	ba	The commission supplied many separate certificates and statements. 	The commission was supplied by many separate certificates and statements.	ba	neutral
1001006	ba	ba	ba	ba	ba	ba	ba	The statues represent the kings.	The statues are represented by the kings.	ba	neutral
1001010	ba	ba	ba	ba	ba	ba	ba	The FDA reviewed the rule to examine the actions involved and determine if it will have a significant impact on the relationship between States and Federal government. 	The FDA was reviewed by the rule to examine the actions involved and determine if it will have a significant impact on the relationship between States and Federal government.	ba	neutral
1001547	ba	ba	ba	ba	ba	ba	ba	The Cinematheque houses a state-of-the-art cinema and a theatrical museum.	The Cinematheque is housed by a state-of-the-art cinema and a theatrical museum.	ba	neutral
1002665	ba	ba	ba	ba	ba	ba	ba	The Council released a document to justify its reordered priorities.	The Council was released by a document to justify its reordered priorities.	ba	neutral
1002494	ba	ba	ba	ba	ba	ba	ba	A sound and light show defended religions.	A sound and light show was defended by religions.	ba	neutral
1003027	ba	ba	ba	ba	ba	ba	ba	The square houses a place where they sell flowers.	The square is housed by a place where they sell flowers.	ba	neutral
1000166	ba	ba	ba	ba	ba	ba	ba	The walk takes most people less than half an hour.	The walk is taken by most people less than half an hour.	ba	neutral
1002866	ba	ba	ba	ba	ba	ba	ba	The above list contains a large number of laws.	The above list is contained by a large number of laws.	ba	neutral
1001303	ba	ba	ba	ba	ba	ba	ba	The large man held a weapon.	The large man was held by a weapon.	ba	neutral
1001259	ba	ba	ba	ba	ba	ba	ba	The lender rejected the loan.	The lender was rejected by the loan.	ba	neutral
1002802	ba	ba	ba	ba	ba	ba	ba	The piece includes a two day quiz for couples.	The piece is included by a two day quiz for couples.	ba	neutral
1000745	ba	ba	ba	ba	ba	ba	ba	These two organizations lost their funding because of chronic mismanagement. 	These two organizations were lost by their funding because of chronic mismanagement.	ba	neutral
1000536	ba	ba	ba	ba	ba	ba	ba	The two sides reached an agreement which ended the war.	The two sides were reached by an agreement which ended the war.	ba	neutral
1001739	ba	ba	ba	ba	ba	ba	ba	The Irish Times interviewed a number of the amendment's supporters.	The Irish Times was interviewed by a number of the amendment 's supporters.	ba	neutral
1000146	ba	ba	ba	ba	ba	ba	ba	All managers create goals for their agencies.	All managers are created by goals for their agencies.	ba	neutral
1001650	ba	ba	ba	ba	ba	ba	ba	a compromise holds a certain level of satisfaction.	a compromise is held by a certain level of satisfaction.	ba	neutral
1000761	ba	ba	ba	ba	ba	ba	ba	The courts charge a $5 filing fee.	The courts are charged by a $ 5 filing fee.	ba	neutral
1002534	ba	ba	ba	ba	ba	ba	ba	The best post seen this week.	The best post was seen by this week.	ba	neutral
1001593	ba	ba	ba	ba	ba	ba	ba	The acid deposition changes the structure of water.	The acid deposition is changed by the structure of water.	ba	neutral
1000746	ba	ba	ba	ba	ba	ba	ba	The bank receives millions of dollars in reductions every year.	The bank is received by millions of dollars in reductions every year.	ba	neutral
1001277	ba	ba	ba	ba	ba	ba	ba	The analysis describes more than five alternative means of assessing fees for small entities.	The analysis is described by more than five alternative means of assessing fees for small entities.	ba	neutral
1000420	ba	ba	ba	ba	ba	ba	ba	The cathedral contains only one major masterpiece of the master Cosmy Tura.  	The cathedral is contained by only one major masterpiece of the master Cosmy Tura.	ba	neutral
1001488	ba	ba	ba	ba	ba	ba	ba	The chairman accused the minority party of being too hard on  molesters.	The chairman was accused by the minority party of being too hard on molesters.	ba	neutral
1002987	ba	ba	ba	ba	ba	ba	ba	This company cares a lot about their employees. 	This company is cared by a lot about their employees.	ba	neutral
1000346	ba	ba	ba	ba	ba	ba	ba	The locals tell tales of two brothers that died after lying.	The locals are told by tales of two brothers that died after lying.	ba	neutral
1001102	ba	ba	ba	ba	ba	ba	ba	Some problems include birht defects.	Some problems are included by birht defects.	ba	neutral
1000219	ba	ba	ba	ba	ba	ba	ba	The GAO uses written material to confirm that critical facts and information are current.	The GAO is used by written material to confirm that critical facts and information are current.	ba	neutral
1000460	ba	ba	ba	ba	ba	ba	ba	The natural paste cleans your mouth.	The natural paste is cleaned by your mouth.	ba	neutral
1001682	ba	ba	ba	ba	ba	ba	ba	The GAO keeps a database of all request letters that is available to the public.	The GAO is kept by a database of all request letters that is available to the public.	ba	neutral
1001318	ba	ba	ba	ba	ba	ba	ba	Each unit monitors their CO2 emissions.	Each unit is monitored by their CO2 emissions.	ba	neutral
1002582	ba	ba	ba	ba	ba	ba	ba	The data concerns the effects of watching TV on brain cells lost.	The data are concerned by the effects of watching TV on brain cells lost.	ba	neutral
1002203	ba	ba	ba	ba	ba	ba	ba	The piece discusses executive kidnappings. 	The piece is discussed by executive kidnappings.	ba	neutral
1001294	ba	ba	ba	ba	ba	ba	ba	The GDP changed less than 0.0001%.	The GDP was changed by less than 0.0001 %.	ba	neutral
1001529	ba	ba	ba	ba	ba	ba	ba	The English queen allowed her cousin to roam freely throughout the country before finally beheading her for treason after 20 years. 	The English queen was allowed by her cousin to roam freely throughout the country before finally beheading her for treason after 20 years.	ba	neutral
1003045	ba	ba	ba	ba	ba	ba	ba	The flash caused the report. 	The flash was caused by the report.	ba	neutral
1001210	ba	ba	ba	ba	ba	ba	ba	The analysis makes no effort to find benefits of the rule when it comes to human health.	The analysis is made by no effort to find benefits of the rule when it comes to human health.	ba	neutral
1000821	ba	ba	ba	ba	ba	ba	ba	The museum holds a lot of information about these figures. 	The museum is held by a lot of information about these figures.	ba	neutral
1000085	ba	ba	ba	ba	ba	ba	ba	The drumbeat followed an unconventional rhythm.	The drumbeat was followed by an unconventional rhythm.	ba	neutral
1000492	ba	ba	ba	ba	ba	ba	ba	A woman named Shoe. 	A woman was named by Shoe.	ba	neutral
1000464	ba	ba	ba	ba	ba	ba	ba	Some women face gender-based discrimination.	Some women are faced by gender-based discrimination.	ba	neutral
1000275	ba	ba	ba	ba	ba	ba	ba	The label caught the attention of Poirot.	The label was caught by the attention of Poirot.	ba	neutral
1000004	ba	ba	ba	ba	ba	ba	ba	The record gave no context regarding the legal question. 	The record was given by no context regarding the legal question.	ba	neutral
1001483	ba	ba	ba	ba	ba	ba	ba	The final rule affects many people in a negative manner.	The final rule is affected by many people in a negative manner.	ba	neutral
1000239	ba	ba	ba	ba	ba	ba	ba	The exhibits feature Alexander Flemming and Alexander Graham Bell. 	The exhibits are featured by Alexander Flemming and Alexander Graham Bell.	ba	neutral
1001247	ba	ba	ba	ba	ba	ba	ba	Some Democrats make negative comments about Republicans.	Some Democrats is made by negative comments about Republicans.	ba	neutral
1000565	ba	ba	ba	ba	ba	ba	ba	The story detailed the successes.	The story was detailed by the successes.	ba	neutral
1003028	ba	ba	ba	ba	ba	ba	ba	An earthquake destroyed the first palace that was built at Knosses.	An earthquake was destroyed by the first palace that was built at Knosses.	ba	neutral
1002414	ba	ba	ba	ba	ba	ba	ba	The legal services ate top notch. 	The legal services were eaten by top notch.	ba	neutral
1000680	ba	ba	ba	ba	ba	ba	ba	These inexpensive knock-off goods do last a long time.	These inexpensive knock-off goods are done by last a long time.	ba	neutral
1001974	ba	ba	ba	ba	ba	ba	ba	The silver dragon-head hammer reflected the red sun's light indicating there was a demon close by.	The silver dragon-head hammer was reflected by the red sun 's light indicating there was a demon close by.	ba	neutral
1002709	ba	ba	ba	ba	ba	ba	ba	The barbarian used his sleeve to wipe the sweat from his brow as the little man yelled at him.	The barbarian was used by his sleeve to wipe the sweat from his brow as the little man yelled at him.	ba	neutral
1000749	ba	ba	ba	ba	ba	ba	ba	The studies yield  Cpk which helps the program streamline their development process.	The studies are yielded by Cpk which helps the program streamline their development process.	ba	neutral
1000888	ba	ba	ba	ba	ba	ba	ba	No one told JUlius anything.	No one was told by JUlius anything.	ba	neutral
1000681	ba	ba	ba	ba	ba	ba	ba	These laws comprise the USPS monopoly.	These laws are comprised by the USPS monopoly.	ba	neutral
1001813	ba	ba	ba	ba	ba	ba	ba	The artifacts include a mummy's foot and a giant ruby.	The artifacts are included by a mummy 's foot and a giant ruby.	ba	neutral
1001051	ba	ba	ba	ba	ba	ba	ba	The craftsmen charge a couple hundred dollars for a smooth and new door frame.	The craftsmen are charged by a couple hundred dollars for a smooth and new door frame.	ba	neutral
1002411	ba	ba	ba	ba	ba	ba	ba	The English won every battle they fought in Picardy.	The English was won by every battle they fought in Picardy.	ba	neutral
1001924	ba	ba	ba	ba	ba	ba	ba	The Government provides a subsidy for blind mail. 	The Government is provided by a subsidy for blind mail.	ba	neutral
1003132	ba	ba	ba	ba	ba	ba	ba	The Times won 2 Pulitzer Prizes.	The Times was won by 2 Pulitzer Prizes.	ba	neutral
1000215	ba	ba	ba	ba	ba	ba	ba	The question generated a record number of differences focused on Mr. Buchanan's politics.	The question was generated by a record number of differences focused on Mr. Buchanan 's politics.	ba	neutral
1000676	ba	ba	ba	ba	ba	ba	ba	A pousada serves wonderful sandwiches.	A pousada is served by wonderful sandwiches.	ba	neutral
1002622	ba	ba	ba	ba	ba	ba	ba	The goals include economic reform and political swiftness.	The goals are included by economic reform and political swiftness.	ba	neutral
1002894	ba	ba	ba	ba	ba	ba	ba	The CEO makes agreements on how to pass out bonuses.	The CEO is made by agreements on how to pass out bonuses.	ba	neutral
1001219	ba	ba	ba	ba	ba	ba	ba	The Koran describes the story of Muhammad.	The Koran is described by the story of Muhammad.	ba	neutral
1001491	ba	ba	ba	ba	ba	ba	ba	The request reflected the senator's special interest in the park.	The request was reflected by the senator 's special interest in the park.	ba	neutral
1002334	ba	ba	ba	ba	ba	ba	ba	The denunciation presented a clear motive for why the crime might have been committed. 	The denunciation was presented by a clear motive for why the crime might have been committed.	ba	neutral
1003076	ba	ba	ba	ba	ba	ba	ba	The session helps people who want to file for divorce with a lawyer.	The session is helped by people who want to file for divorce with a lawyer.	ba	neutral
1001755	ba	ba	ba	ba	ba	ba	ba	The warlocks grabbed any weaponry they could find.	The warlocks were grabbed by any weaponry they could find.	ba	neutral
1002088	ba	ba	ba	ba	ba	ba	ba	The last scene shows a father and daughter climbing mountains. 	The last scene is shown by a father and daughter climbing mountains.	ba	neutral
1000081	ba	ba	ba	ba	ba	ba	ba	The table shows the results of a survey of major suppliers of CO2.	The table is shown by the results of a survey of major suppliers of CO2.	ba	neutral
1002676	ba	ba	ba	ba	ba	ba	ba	The palace added 5000 square feet.	The palace was added by 5000 square feet.	ba	neutral
1002299	ba	ba	ba	ba	ba	ba	ba	The gift offers foresight and incredible wisdom.	The gift is offered by foresight and incredible wisdom.	ba	neutral
1001186	ba	ba	ba	ba	ba	ba	ba	All law graduates finish college free of debt.	All law is graduated by finish college free of debt.	ba	neutral
1001286	ba	ba	ba	ba	ba	ba	ba	The journey takes approximately 2 hours.	The journey is taken by approximately 2 hours.	ba	neutral
1001543	ba	ba	ba	ba	ba	ba	ba	The rules add all sorts of new reporting, records, and compliance requirements.	The rules are added by all sorts of new reporting , records , and compliance requirements.	ba	neutral
1001079	ba	ba	ba	ba	ba	ba	ba	The ITC developed an online community that promised to be user-friendly. 	The ITC was developed by an online community that promised to be user-friendly.	ba	neutral
1000995	ba	ba	ba	ba	ba	ba	ba	The US started a war against Japan that went on for seven years.	The US was started by a war against Japan that went on for seven years.	ba	neutral
1000784	ba	ba	ba	ba	ba	ba	ba	The crowd likes accidents where people die.	The crowd is liked by accidents where people die.	ba	neutral
1001608	ba	ba	ba	ba	ba	ba	ba	The fellow wears a beret to accentuate his mustache.	The fellow is worn by a beret to accentuate his mustache.	ba	neutral
1001920	ba	ba	ba	ba	ba	ba	ba	The programs strengthen existing financial incentives for lenders.	The programs are strengthened by existing financial incentives for lenders.	ba	neutral
1002174	ba	ba	ba	ba	ba	ba	ba	The fatimid period On the main street developed the market.	The fatimid period was developed by the main street.	ba	neutral
1000899	ba	ba	ba	ba	ba	ba	ba	The estimates neglect the quantity of imported fresh pork.	The estimates are neglected by the quantity of imported fresh pork.	ba	neutral
1002283	ba	ba	ba	ba	ba	ba	ba	The Buddhists destroyed the Stupa burrial mounds.	The Buddhists was destroyed by the Stupa burrial mounds.	ba	neutral
1002220	ba	ba	ba	ba	ba	ba	ba	The little man did an outrageous act.	The little man was done by an outrageous act.	ba	neutral
1002018	ba	ba	ba	ba	ba	ba	ba	The final rule relates the tail pipe emissions of naval airplanes. 	The final rule is related by the tail pipe emissions of naval airplanes.	ba	neutral
1000516	ba	ba	ba	ba	ba	ba	ba	The postal service developed a coverage system.	The postal service was developed by a coverage system.	ba	neutral
1002796	ba	ba	ba	ba	ba	ba	ba	The biography tells the story of an old doctor. 	The biography is told by the story of an old doctor.	ba	neutral
1001018	ba	ba	ba	ba	ba	ba	ba	The palace welcomes visitors on certain days.	The palace is welcomed by visitors on certain days.	ba	neutral
1000003	ba	ba	ba	ba	ba	ba	ba	The table shows a summary of the resources in demand.	The table is shown by a summary of the resources in demand.	ba	neutral
1002154	ba	ba	ba	ba	ba	ba	ba	The legislature outlawed gambling in 1931 which prevented the town from being prosperous in the future.	The legislature was outlawed by gambling in 1931 which prevented the town from being prosperous in the future.	ba	neutral
1000194	ba	ba	ba	ba	ba	ba	ba	This approach produced good results.	This approach was produced by good results.	ba	neutral
1001727	ba	ba	ba	ba	ba	ba	ba	The report shows the work the grantees are doing for clients who are poor.	The report is shown by the work the grantees are doing for clients who are poor.	ba	neutral
1000651	ba	ba	ba	ba	ba	ba	ba	The high-end accommodations raise the standards of expectation.	The high-end accommodations are raised by the standards of expectation.	ba	neutral
1002877	ba	ba	ba	ba	ba	ba	ba	The Portuguese controlled the southern half of the peninsula.	The Portuguese was controlled by the southern half of the peninsula.	ba	neutral
1000368	ba	ba	ba	ba	ba	ba	ba	The lawyers disregarded her interpretation of the law.	The lawyers were disregarded by her interpretation of the law.	ba	neutral
1001643	ba	ba	ba	ba	ba	ba	ba	The festival takes place in the winter time.	The festival is taken by place in the winter time.	ba	neutral
1002364	ba	ba	ba	ba	ba	ba	ba	The giraffe indicates the Indian west coast's early contact with Africa.	The giraffe is indicated by the Indian west coast 's early contact with Africa.	ba	neutral
1002312	ba	ba	ba	ba	ba	ba	ba	This conveniently precludes any legal divergence between these sections and the rule.	This conveniently is precluded by any legal divergence between these sections and the rule.	ba	neutral
1002980	ba	ba	ba	ba	ba	ba	ba	The described models require estimates for the new system.	The described models are required by estimates for the new system.	ba	neutral
1000490	ba	ba	ba	ba	ba	ba	ba	The tip pierced his stomach.	The tip was pierced by his stomach.	ba	neutral
